,title,score,id,subreddit,url,num_comments,body,created,comments,post_url
77,‘Please Do Your Job!!!’: Private Citizens Urge Judge To Jail Bankman-Fried Before Fraud Trial,1746,118fikm,CryptoCurrency,/r/CryptoCurrency/comments/118fikm/please_do_your_job_private_citizens_urge_judge_to/,271,,1677014710.0,Is there a reason the judge does not consider him a flight risk?,/r/CryptoCurrency/comments/118fikm/please_do_your_job_private_citizens_urge_judge_to/
78,‘Please Do Your Job!!!’: Private Citizens Urge Judge To Jail Bankman-Fried Before Fraud Trial,1746,118fikm,CryptoCurrency,/r/CryptoCurrency/comments/118fikm/please_do_your_job_private_citizens_urge_judge_to/,271,,1677014710.0,Maybe the author has read this subreddit too much as we have been saying this every fucking day. Lock him up,/r/CryptoCurrency/comments/118fikm/please_do_your_job_private_citizens_urge_judge_to/
79,‘Please Do Your Job!!!’: Private Citizens Urge Judge To Jail Bankman-Fried Before Fraud Trial,1746,118fikm,CryptoCurrency,/r/CryptoCurrency/comments/118fikm/please_do_your_job_private_citizens_urge_judge_to/,271,,1677014710.0,Karma is a bitch and I'm sure she'll get him sooner or later.,/r/CryptoCurrency/comments/118fikm/please_do_your_job_private_citizens_urge_judge_to/
80,‘Please Do Your Job!!!’: Private Citizens Urge Judge To Jail Bankman-Fried Before Fraud Trial,1746,118fikm,CryptoCurrency,/r/CryptoCurrency/comments/118fikm/please_do_your_job_private_citizens_urge_judge_to/,271,,1677014710.0,Let him face Dwight's rights,/r/CryptoCurrency/comments/118fikm/please_do_your_job_private_citizens_urge_judge_to/
81,‘Please Do Your Job!!!’: Private Citizens Urge Judge To Jail Bankman-Fried Before Fraud Trial,1746,118fikm,CryptoCurrency,/r/CryptoCurrency/comments/118fikm/please_do_your_job_private_citizens_urge_judge_to/,271,,1677014710.0,Won’t set a great example if he gets off somehow,/r/CryptoCurrency/comments/118fikm/please_do_your_job_private_citizens_urge_judge_to/
82,‘Please Do Your Job!!!’: Private Citizens Urge Judge To Jail Bankman-Fried Before Fraud Trial,1746,118fikm,CryptoCurrency,/r/CryptoCurrency/comments/118fikm/please_do_your_job_private_citizens_urge_judge_to/,271,,1677014710.0,It seems like the judge has been soft on him. Dude had a laptop ready to go when he got off the flight from jail.,/r/CryptoCurrency/comments/118fikm/please_do_your_job_private_citizens_urge_judge_to/
83,‘Please Do Your Job!!!’: Private Citizens Urge Judge To Jail Bankman-Fried Before Fraud Trial,1746,118fikm,CryptoCurrency,/r/CryptoCurrency/comments/118fikm/please_do_your_job_private_citizens_urge_judge_to/,271,,1677014710.0,A common enemy we all want to see punished. We will all appreciate some justice here your Honor. He is #1 crypto's enemy.,/r/CryptoCurrency/comments/118fikm/please_do_your_job_private_citizens_urge_judge_to/
84,‘Please Do Your Job!!!’: Private Citizens Urge Judge To Jail Bankman-Fried Before Fraud Trial,1746,118fikm,CryptoCurrency,/r/CryptoCurrency/comments/118fikm/please_do_your_job_private_citizens_urge_judge_to/,271,,1677014710.0,Lock him up. I’m ready 😵‍💫,/r/CryptoCurrency/comments/118fikm/please_do_your_job_private_citizens_urge_judge_to/
85,‘Please Do Your Job!!!’: Private Citizens Urge Judge To Jail Bankman-Fried Before Fraud Trial,1746,118fikm,CryptoCurrency,/r/CryptoCurrency/comments/118fikm/please_do_your_job_private_citizens_urge_judge_to/,271,,1677014710.0,Innocent until proven guilty in the US. He’ll be in prison soon enough. Y’all need to relax. He is owed due process just like the rest of us.,/r/CryptoCurrency/comments/118fikm/please_do_your_job_private_citizens_urge_judge_to/
86,‘Please Do Your Job!!!’: Private Citizens Urge Judge To Jail Bankman-Fried Before Fraud Trial,1746,118fikm,CryptoCurrency,/r/CryptoCurrency/comments/118fikm/please_do_your_job_private_citizens_urge_judge_to/,271,,1677014710.0,He needs to get in jail to finish the saga and let the netflix finally start their documentary,/r/CryptoCurrency/comments/118fikm/please_do_your_job_private_citizens_urge_judge_to/
87,‘Please Do Your Job!!!’: Private Citizens Urge Judge To Jail Bankman-Fried Before Fraud Trial,1746,118fikm,CryptoCurrency,/r/CryptoCurrency/comments/118fikm/please_do_your_job_private_citizens_urge_judge_to/,271,,1677014710.0,His facial expression looks like he even don't regret about this FTX fraud activity.,/r/CryptoCurrency/comments/118fikm/please_do_your_job_private_citizens_urge_judge_to/
88,‘Please Do Your Job!!!’: Private Citizens Urge Judge To Jail Bankman-Fried Before Fraud Trial,1746,118fikm,CryptoCurrency,/r/CryptoCurrency/comments/118fikm/please_do_your_job_private_citizens_urge_judge_to/,271,,1677014710.0,"There are people who have possessed a few grams of cannabis - that effects nobody - sitting in jail. Somehow, the courts are indecisive of this plunderer of a million people.",/r/CryptoCurrency/comments/118fikm/please_do_your_job_private_citizens_urge_judge_to/
89,‘Please Do Your Job!!!’: Private Citizens Urge Judge To Jail Bankman-Fried Before Fraud Trial,1746,118fikm,CryptoCurrency,/r/CryptoCurrency/comments/118fikm/please_do_your_job_private_citizens_urge_judge_to/,271,,1677014710.0,"fact is if government did their job ftx would never have happened, but they are to busy cancelling legit stuff like paxos, etfs, binance, ripple",/r/CryptoCurrency/comments/118fikm/please_do_your_job_private_citizens_urge_judge_to/
90,‘Please Do Your Job!!!’: Private Citizens Urge Judge To Jail Bankman-Fried Before Fraud Trial,1746,118fikm,CryptoCurrency,/r/CryptoCurrency/comments/118fikm/please_do_your_job_private_citizens_urge_judge_to/,271,,1677014710.0,I’m sure SBF is lounging in some nice warm sunny laughing just thinking about this chirade.,/r/CryptoCurrency/comments/118fikm/please_do_your_job_private_citizens_urge_judge_to/
91,‘Please Do Your Job!!!’: Private Citizens Urge Judge To Jail Bankman-Fried Before Fraud Trial,1746,118fikm,CryptoCurrency,/r/CryptoCurrency/comments/118fikm/please_do_your_job_private_citizens_urge_judge_to/,271,,1677014710.0,"I have serious concerns about this judge. He and his family should be controlled if accidentally no one send them any valuable gifts, cause it look sus ad hell.",/r/CryptoCurrency/comments/118fikm/please_do_your_job_private_citizens_urge_judge_to/
92,‘Please Do Your Job!!!’: Private Citizens Urge Judge To Jail Bankman-Fried Before Fraud Trial,1746,118fikm,CryptoCurrency,/r/CryptoCurrency/comments/118fikm/please_do_your_job_private_citizens_urge_judge_to/,271,,1677014710.0,"For his own safety, he should be imprisoned. I didn’t lose money but surely there’s people out for his blood.",/r/CryptoCurrency/comments/118fikm/please_do_your_job_private_citizens_urge_judge_to/
93,‘Please Do Your Job!!!’: Private Citizens Urge Judge To Jail Bankman-Fried Before Fraud Trial,1746,118fikm,CryptoCurrency,/r/CryptoCurrency/comments/118fikm/please_do_your_job_private_citizens_urge_judge_to/,271,,1677014710.0,"He belongs in prison.

Despite this, I really hope the public learns not to leave your assets on your exchange wallet and invest in cold storage.",/r/CryptoCurrency/comments/118fikm/please_do_your_job_private_citizens_urge_judge_to/
94,‘Please Do Your Job!!!’: Private Citizens Urge Judge To Jail Bankman-Fried Before Fraud Trial,1746,118fikm,CryptoCurrency,/r/CryptoCurrency/comments/118fikm/please_do_your_job_private_citizens_urge_judge_to/,271,,1677014710.0,"With the amount of money that man stole verses the way they are treating him you'd think he did way, way less. They need to make an example out of this piece of garbage.",/r/CryptoCurrency/comments/118fikm/please_do_your_job_private_citizens_urge_judge_to/
95,‘Please Do Your Job!!!’: Private Citizens Urge Judge To Jail Bankman-Fried Before Fraud Trial,1746,118fikm,CryptoCurrency,/r/CryptoCurrency/comments/118fikm/please_do_your_job_private_citizens_urge_judge_to/,271,,1677014710.0,"elite boi will walk free.

These stupid pesky laws, KYC and AML bullshit are only for us dumbfuck peasants, to keep us outside of their shitty club houses.",/r/CryptoCurrency/comments/118fikm/please_do_your_job_private_citizens_urge_judge_to/
96,‘Please Do Your Job!!!’: Private Citizens Urge Judge To Jail Bankman-Fried Before Fraud Trial,1746,118fikm,CryptoCurrency,/r/CryptoCurrency/comments/118fikm/please_do_your_job_private_citizens_urge_judge_to/,271,,1677014710.0,If only they knew. The judge's hands may be tied. Dealing with frauds like SBF ain't easy.,/r/CryptoCurrency/comments/118fikm/please_do_your_job_private_citizens_urge_judge_to/
97,‘Please Do Your Job!!!’: Private Citizens Urge Judge To Jail Bankman-Fried Before Fraud Trial,1746,118fikm,CryptoCurrency,/r/CryptoCurrency/comments/118fikm/please_do_your_job_private_citizens_urge_judge_to/,271,,1677014710.0,"Dude is more famous than before the fraud he’s literally famous like ELON right now. I know one thing, takes huge nuts to swindle millions of people. It’s kinda like giving money to a church for 15 years recurring and when you need the church they tell you we can l’t help you at all sorry lol",/r/CryptoCurrency/comments/118fikm/please_do_your_job_private_citizens_urge_judge_to/
98,‘Please Do Your Job!!!’: Private Citizens Urge Judge To Jail Bankman-Fried Before Fraud Trial,1746,118fikm,CryptoCurrency,/r/CryptoCurrency/comments/118fikm/please_do_your_job_private_citizens_urge_judge_to/,271,,1677014710.0,This guy needs to be locked for the future of crypto.,/r/CryptoCurrency/comments/118fikm/please_do_your_job_private_citizens_urge_judge_to/
99,‘Please Do Your Job!!!’: Private Citizens Urge Judge To Jail Bankman-Fried Before Fraud Trial,1746,118fikm,CryptoCurrency,/r/CryptoCurrency/comments/118fikm/please_do_your_job_private_citizens_urge_judge_to/,271,,1677014710.0,That whole FTX Scooby Doo Gang is in the DNC Pockets...,/r/CryptoCurrency/comments/118fikm/please_do_your_job_private_citizens_urge_judge_to/
100,‘Please Do Your Job!!!’: Private Citizens Urge Judge To Jail Bankman-Fried Before Fraud Trial,1746,118fikm,CryptoCurrency,/r/CryptoCurrency/comments/118fikm/please_do_your_job_private_citizens_urge_judge_to/,271,,1677014710.0,"I think when you ruin as many lives as this guy has, capital punishment should be on the table.",/r/CryptoCurrency/comments/118fikm/please_do_your_job_private_citizens_urge_judge_to/
101,‘Please Do Your Job!!!’: Private Citizens Urge Judge To Jail Bankman-Fried Before Fraud Trial,1746,118fikm,CryptoCurrency,/r/CryptoCurrency/comments/118fikm/please_do_your_job_private_citizens_urge_judge_to/,271,,1677014710.0,"Judge: ""Haha lol no"".",/r/CryptoCurrency/comments/118fikm/please_do_your_job_private_citizens_urge_judge_to/
102,‘Please Do Your Job!!!’: Private Citizens Urge Judge To Jail Bankman-Fried Before Fraud Trial,1746,118fikm,CryptoCurrency,/r/CryptoCurrency/comments/118fikm/please_do_your_job_private_citizens_urge_judge_to/,271,,1677014710.0,"If he could he would buy is way out of of trouble , keep an eye on that judge…",/r/CryptoCurrency/comments/118fikm/please_do_your_job_private_citizens_urge_judge_to/
103,‘Please Do Your Job!!!’: Private Citizens Urge Judge To Jail Bankman-Fried Before Fraud Trial,1746,118fikm,CryptoCurrency,/r/CryptoCurrency/comments/118fikm/please_do_your_job_private_citizens_urge_judge_to/,271,,1677014710.0,"Seems to make sense, given how almost every week he seems to be violating something",/r/CryptoCurrency/comments/118fikm/please_do_your_job_private_citizens_urge_judge_to/
104,‘Please Do Your Job!!!’: Private Citizens Urge Judge To Jail Bankman-Fried Before Fraud Trial,1746,118fikm,CryptoCurrency,/r/CryptoCurrency/comments/118fikm/please_do_your_job_private_citizens_urge_judge_to/,271,,1677014710.0,Make the bad man suffer!,/r/CryptoCurrency/comments/118fikm/please_do_your_job_private_citizens_urge_judge_to/
105,‘Please Do Your Job!!!’: Private Citizens Urge Judge To Jail Bankman-Fried Before Fraud Trial,1746,118fikm,CryptoCurrency,/r/CryptoCurrency/comments/118fikm/please_do_your_job_private_citizens_urge_judge_to/,271,,1677014710.0,"fair demand, lots of people were fcked over, and the people behind it should be punished",/r/CryptoCurrency/comments/118fikm/please_do_your_job_private_citizens_urge_judge_to/
106,‘Please Do Your Job!!!’: Private Citizens Urge Judge To Jail Bankman-Fried Before Fraud Trial,1746,118fikm,CryptoCurrency,/r/CryptoCurrency/comments/118fikm/please_do_your_job_private_citizens_urge_judge_to/,271,,1677014710.0,"Hello, yes please.",/r/CryptoCurrency/comments/118fikm/please_do_your_job_private_citizens_urge_judge_to/
107,‘Please Do Your Job!!!’: Private Citizens Urge Judge To Jail Bankman-Fried Before Fraud Trial,1746,118fikm,CryptoCurrency,/r/CryptoCurrency/comments/118fikm/please_do_your_job_private_citizens_urge_judge_to/,271,,1677014710.0,They work for the highest bidder,/r/CryptoCurrency/comments/118fikm/please_do_your_job_private_citizens_urge_judge_to/
108,‘Please Do Your Job!!!’: Private Citizens Urge Judge To Jail Bankman-Fried Before Fraud Trial,1746,118fikm,CryptoCurrency,/r/CryptoCurrency/comments/118fikm/please_do_your_job_private_citizens_urge_judge_to/,271,,1677014710.0,If the US governments really want to be taken serious when it comes to regulation and being seen to do something then this is a real good chance for them to do so.,/r/CryptoCurrency/comments/118fikm/please_do_your_job_private_citizens_urge_judge_to/
109,‘Please Do Your Job!!!’: Private Citizens Urge Judge To Jail Bankman-Fried Before Fraud Trial,1746,118fikm,CryptoCurrency,/r/CryptoCurrency/comments/118fikm/please_do_your_job_private_citizens_urge_judge_to/,271,,1677014710.0,It really is uncommon to see financially important people being prosecuted. Hope he gets what he deserves,/r/CryptoCurrency/comments/118fikm/please_do_your_job_private_citizens_urge_judge_to/
110,‘Please Do Your Job!!!’: Private Citizens Urge Judge To Jail Bankman-Fried Before Fraud Trial,1746,118fikm,CryptoCurrency,/r/CryptoCurrency/comments/118fikm/please_do_your_job_private_citizens_urge_judge_to/,271,,1677014710.0,Probably in the minority but I don't see SBF getting jailed for his crimes not in the near future at least,/r/CryptoCurrency/comments/118fikm/please_do_your_job_private_citizens_urge_judge_to/
111,‘Please Do Your Job!!!’: Private Citizens Urge Judge To Jail Bankman-Fried Before Fraud Trial,1746,118fikm,CryptoCurrency,/r/CryptoCurrency/comments/118fikm/please_do_your_job_private_citizens_urge_judge_to/,271,,1677014710.0,"Crazy to think, when a guy that steels $500 worth of meat can’t get bail but this DB is out walking free.",/r/CryptoCurrency/comments/118fikm/please_do_your_job_private_citizens_urge_judge_to/
112,‘Please Do Your Job!!!’: Private Citizens Urge Judge To Jail Bankman-Fried Before Fraud Trial,1746,118fikm,CryptoCurrency,/r/CryptoCurrency/comments/118fikm/please_do_your_job_private_citizens_urge_judge_to/,271,,1677014710.0,He's a fraudster. Take away crypto. Take away market manipulation. Take away cominglingling of funds. He's still a fraudster. A greedy and awful human being,/r/CryptoCurrency/comments/118fikm/please_do_your_job_private_citizens_urge_judge_to/
113,‘Please Do Your Job!!!’: Private Citizens Urge Judge To Jail Bankman-Fried Before Fraud Trial,1746,118fikm,CryptoCurrency,/r/CryptoCurrency/comments/118fikm/please_do_your_job_private_citizens_urge_judge_to/,271,,1677014710.0,"Money is part of crime and punishment.  The court of public opinions is also part of crime and punishment.  Enough pressure will cause the judge to yield.  The good thing is that his financial footprint can be audited, and therefore we may see other bad actors, their justifications for similar behavior as well as how we may evolve the human social contract to minimize if not entirely remove such harmful financial behaviors.  This is exactly why we need a public ledger.

Edit:  grammar.",/r/CryptoCurrency/comments/118fikm/please_do_your_job_private_citizens_urge_judge_to/
114,‘Please Do Your Job!!!’: Private Citizens Urge Judge To Jail Bankman-Fried Before Fraud Trial,1746,118fikm,CryptoCurrency,/r/CryptoCurrency/comments/118fikm/please_do_your_job_private_citizens_urge_judge_to/,271,,1677014710.0,"""Please disregard *due process, which is your job,* and do your job by illegally jailing this person *without due process*!""

&#x200B;

That's not how it works. The cryptosphere might have *no regulations* (yet) but the whole of society is full of them. Your public opinion, while slightly relevant, is not important.

 **I rather wait a year to see SBF be condemned to jail than see him in jail today and have the whole process be nullified because it didn't respect due process and the Constitution.**",/r/CryptoCurrency/comments/118fikm/please_do_your_job_private_citizens_urge_judge_to/
115,‘Please Do Your Job!!!’: Private Citizens Urge Judge To Jail Bankman-Fried Before Fraud Trial,1746,118fikm,CryptoCurrency,/r/CryptoCurrency/comments/118fikm/please_do_your_job_private_citizens_urge_judge_to/,271,,1677014710.0,"When you are the Democratic top donor, you too can avoid jail",/r/CryptoCurrency/comments/118fikm/please_do_your_job_private_citizens_urge_judge_to/
116,‘Please Do Your Job!!!’: Private Citizens Urge Judge To Jail Bankman-Fried Before Fraud Trial,1746,118fikm,CryptoCurrency,/r/CryptoCurrency/comments/118fikm/please_do_your_job_private_citizens_urge_judge_to/,271,,1677014710.0,US still have chain gangs? I’d like to see this guy on one of those,/r/CryptoCurrency/comments/118fikm/please_do_your_job_private_citizens_urge_judge_to/
117,‘Please Do Your Job!!!’: Private Citizens Urge Judge To Jail Bankman-Fried Before Fraud Trial,1746,118fikm,CryptoCurrency,/r/CryptoCurrency/comments/118fikm/please_do_your_job_private_citizens_urge_judge_to/,271,,1677014710.0,I can't wait until he is nothing more than a Netflix documentary!,/r/CryptoCurrency/comments/118fikm/please_do_your_job_private_citizens_urge_judge_to/
118,‘Please Do Your Job!!!’: Private Citizens Urge Judge To Jail Bankman-Fried Before Fraud Trial,1746,118fikm,CryptoCurrency,/r/CryptoCurrency/comments/118fikm/please_do_your_job_private_citizens_urge_judge_to/,271,,1677014710.0,"Unless he is dangerous or a flight risk, he should be free before he’s convicted and sentenced.",/r/CryptoCurrency/comments/118fikm/please_do_your_job_private_citizens_urge_judge_to/
119,‘Please Do Your Job!!!’: Private Citizens Urge Judge To Jail Bankman-Fried Before Fraud Trial,1746,118fikm,CryptoCurrency,/r/CryptoCurrency/comments/118fikm/please_do_your_job_private_citizens_urge_judge_to/,271,,1677014710.0,Be weird if he were held accountable or something..,/r/CryptoCurrency/comments/118fikm/please_do_your_job_private_citizens_urge_judge_to/
120,‘Please Do Your Job!!!’: Private Citizens Urge Judge To Jail Bankman-Fried Before Fraud Trial,1746,118fikm,CryptoCurrency,/r/CryptoCurrency/comments/118fikm/please_do_your_job_private_citizens_urge_judge_to/,271,,1677014710.0,Well one must know who he is they don't jail their kind. Unless it is really unavoidable.,/r/CryptoCurrency/comments/118fikm/please_do_your_job_private_citizens_urge_judge_to/
121,‘Please Do Your Job!!!’: Private Citizens Urge Judge To Jail Bankman-Fried Before Fraud Trial,1746,118fikm,CryptoCurrency,/r/CryptoCurrency/comments/118fikm/please_do_your_job_private_citizens_urge_judge_to/,271,,1677014710.0,People in r/ cc will be partying the day this happens,/r/CryptoCurrency/comments/118fikm/please_do_your_job_private_citizens_urge_judge_to/
122,‘Please Do Your Job!!!’: Private Citizens Urge Judge To Jail Bankman-Fried Before Fraud Trial,1746,118fikm,CryptoCurrency,/r/CryptoCurrency/comments/118fikm/please_do_your_job_private_citizens_urge_judge_to/,271,,1677014710.0,What is public citizens doing,/r/CryptoCurrency/comments/118fikm/please_do_your_job_private_citizens_urge_judge_to/
123,‘Please Do Your Job!!!’: Private Citizens Urge Judge To Jail Bankman-Fried Before Fraud Trial,1746,118fikm,CryptoCurrency,/r/CryptoCurrency/comments/118fikm/please_do_your_job_private_citizens_urge_judge_to/,271,,1677014710.0,Put him away and forget where the key is,/r/CryptoCurrency/comments/118fikm/please_do_your_job_private_citizens_urge_judge_to/
124,‘Please Do Your Job!!!’: Private Citizens Urge Judge To Jail Bankman-Fried Before Fraud Trial,1746,118fikm,CryptoCurrency,/r/CryptoCurrency/comments/118fikm/please_do_your_job_private_citizens_urge_judge_to/,271,,1677014710.0,He’s like a weird gremlin that won’t go away,/r/CryptoCurrency/comments/118fikm/please_do_your_job_private_citizens_urge_judge_to/
125,‘Please Do Your Job!!!’: Private Citizens Urge Judge To Jail Bankman-Fried Before Fraud Trial,1746,118fikm,CryptoCurrency,/r/CryptoCurrency/comments/118fikm/please_do_your_job_private_citizens_urge_judge_to/,271,,1677014710.0,It would be a necessary step in rebuilding cryptos reputation after the deluge of high profile crimes committed recently.,/r/CryptoCurrency/comments/118fikm/please_do_your_job_private_citizens_urge_judge_to/
126,‘Please Do Your Job!!!’: Private Citizens Urge Judge To Jail Bankman-Fried Before Fraud Trial,1746,118fikm,CryptoCurrency,/r/CryptoCurrency/comments/118fikm/please_do_your_job_private_citizens_urge_judge_to/,271,,1677014710.0,"One way or another, he is going down in crypto history",/r/CryptoCurrency/comments/118fikm/please_do_your_job_private_citizens_urge_judge_to/
127,‘Please Do Your Job!!!’: Private Citizens Urge Judge To Jail Bankman-Fried Before Fraud Trial,1746,118fikm,CryptoCurrency,/r/CryptoCurrency/comments/118fikm/please_do_your_job_private_citizens_urge_judge_to/,271,,1677014710.0,I think considering how badly he has screwed people over it would go a long way in fighting the perception that donating millions to politicians won't warrant you license to do whatever the hell you want.,/r/CryptoCurrency/comments/118fikm/please_do_your_job_private_citizens_urge_judge_to/
128,‘Please Do Your Job!!!’: Private Citizens Urge Judge To Jail Bankman-Fried Before Fraud Trial,1746,118fikm,CryptoCurrency,/r/CryptoCurrency/comments/118fikm/please_do_your_job_private_citizens_urge_judge_to/,271,,1677014710.0,Biggest white collar crime in history. Fucker should be locked up meanwhile he’s in parents basement playing video game and break rules of  bail.,/r/CryptoCurrency/comments/118fikm/please_do_your_job_private_citizens_urge_judge_to/
129,‘Please Do Your Job!!!’: Private Citizens Urge Judge To Jail Bankman-Fried Before Fraud Trial,1746,118fikm,CryptoCurrency,/r/CryptoCurrency/comments/118fikm/please_do_your_job_private_citizens_urge_judge_to/,271,,1677014710.0,"One rule for us, another for them",/r/CryptoCurrency/comments/118fikm/please_do_your_job_private_citizens_urge_judge_to/
130,‘Please Do Your Job!!!’: Private Citizens Urge Judge To Jail Bankman-Fried Before Fraud Trial,1746,118fikm,CryptoCurrency,/r/CryptoCurrency/comments/118fikm/please_do_your_job_private_citizens_urge_judge_to/,271,,1677014710.0,For how many years could he be in prison?,/r/CryptoCurrency/comments/118fikm/please_do_your_job_private_citizens_urge_judge_to/
131,‘Please Do Your Job!!!’: Private Citizens Urge Judge To Jail Bankman-Fried Before Fraud Trial,1746,118fikm,CryptoCurrency,/r/CryptoCurrency/comments/118fikm/please_do_your_job_private_citizens_urge_judge_to/,271,,1677014710.0,"A completely broken justice system for poors, works great if you have money though.",/r/CryptoCurrency/comments/118fikm/please_do_your_job_private_citizens_urge_judge_to/
132,‘Please Do Your Job!!!’: Private Citizens Urge Judge To Jail Bankman-Fried Before Fraud Trial,1746,118fikm,CryptoCurrency,/r/CryptoCurrency/comments/118fikm/please_do_your_job_private_citizens_urge_judge_to/,271,,1677014710.0,It would be better for this sub because we would not have to see any more posts about him.,/r/CryptoCurrency/comments/118fikm/please_do_your_job_private_citizens_urge_judge_to/
133,‘Please Do Your Job!!!’: Private Citizens Urge Judge To Jail Bankman-Fried Before Fraud Trial,1746,118fikm,CryptoCurrency,/r/CryptoCurrency/comments/118fikm/please_do_your_job_private_citizens_urge_judge_to/,271,,1677014710.0,"I’ll believe it when I see it. I still can’t shake the feeling that he’ll either get off on some bullshit technicality, or get a really light sentence at a prison that might as well be a country club. Hope this feeling is wrong though!",/r/CryptoCurrency/comments/118fikm/please_do_your_job_private_citizens_urge_judge_to/
134,‘Please Do Your Job!!!’: Private Citizens Urge Judge To Jail Bankman-Fried Before Fraud Trial,1746,118fikm,CryptoCurrency,/r/CryptoCurrency/comments/118fikm/please_do_your_job_private_citizens_urge_judge_to/,271,,1677014710.0,"The whole community *

Not just crypto",/r/CryptoCurrency/comments/118fikm/please_do_your_job_private_citizens_urge_judge_to/
135,‘Please Do Your Job!!!’: Private Citizens Urge Judge To Jail Bankman-Fried Before Fraud Trial,1746,118fikm,CryptoCurrency,/r/CryptoCurrency/comments/118fikm/please_do_your_job_private_citizens_urge_judge_to/,271,,1677014710.0,"We need that meme with the guy sitting in front of the desk ""Tell me I'm wrong"". 

SBF proving that he knows he won't ever do any real time.",/r/CryptoCurrency/comments/118fikm/please_do_your_job_private_citizens_urge_judge_to/
136,‘Please Do Your Job!!!’: Private Citizens Urge Judge To Jail Bankman-Fried Before Fraud Trial,1746,118fikm,CryptoCurrency,/r/CryptoCurrency/comments/118fikm/please_do_your_job_private_citizens_urge_judge_to/,271,,1677014710.0,"Yes, in a fair world he would be in jail and the scammed people would be getting their money back.",/r/CryptoCurrency/comments/118fikm/please_do_your_job_private_citizens_urge_judge_to/
