,title,score,id,subreddit,url,num_comments,body,created,comments,post_url
197,‘Please Do Your Job!!!’: Private Citizens Urge Judge To Jail Bankman-Fried Before Fraud Trial,1746,118fikm,CryptoCurrency,/r/CryptoCurrency/comments/118fikm/please_do_your_job_private_citizens_urge_judge_to/,271,,1677014710.0,"Bail is usually based on (1) are you a danger to the public and (2) are you a flight risk.

I don’t see how breaking FTX’s ToS affects the analysis of either.

As for (2), he willingly turned himself in while abroad which heavily militates against him being a flight risk",/r/CryptoCurrency/comments/118fikm/please_do_your_job_private_citizens_urge_judge_to/
198,‘Please Do Your Job!!!’: Private Citizens Urge Judge To Jail Bankman-Fried Before Fraud Trial,1746,118fikm,CryptoCurrency,/r/CryptoCurrency/comments/118fikm/please_do_your_job_private_citizens_urge_judge_to/,271,,1677014710.0,No surprise. Rich people play by different rules. Life on easy mode,/r/CryptoCurrency/comments/118fikm/please_do_your_job_private_citizens_urge_judge_to/
199,‘Please Do Your Job!!!’: Private Citizens Urge Judge To Jail Bankman-Fried Before Fraud Trial,1746,118fikm,CryptoCurrency,/r/CryptoCurrency/comments/118fikm/please_do_your_job_private_citizens_urge_judge_to/,271,,1677014710.0,"His millions in bribes to those political organizations helped him at the end.

Seems like he always knew that he needs connections as it may not end well for him.",/r/CryptoCurrency/comments/118fikm/please_do_your_job_private_citizens_urge_judge_to/
200,‘Please Do Your Job!!!’: Private Citizens Urge Judge To Jail Bankman-Fried Before Fraud Trial,1746,118fikm,CryptoCurrency,/r/CryptoCurrency/comments/118fikm/please_do_your_job_private_citizens_urge_judge_to/,271,,1677014710.0,"SBF is a danger to the victims he stole from because FTX funds are mysteriously being transferred out to wallets and there's every chance that it's the fraudster who stole billions having access to keys that is doing it

This guy should not be free on bail after stealing billions if the Tornado cash guy who simply created the software and didn't do anything active to harm anyone got denied bail",/r/CryptoCurrency/comments/118fikm/please_do_your_job_private_citizens_urge_judge_to/
201,‘Please Do Your Job!!!’: Private Citizens Urge Judge To Jail Bankman-Fried Before Fraud Trial,1746,118fikm,CryptoCurrency,/r/CryptoCurrency/comments/118fikm/please_do_your_job_private_citizens_urge_judge_to/,271,,1677014710.0,Very true - I’m sick of seeing his face,/r/CryptoCurrency/comments/118fikm/please_do_your_job_private_citizens_urge_judge_to/
202,‘Please Do Your Job!!!’: Private Citizens Urge Judge To Jail Bankman-Fried Before Fraud Trial,1746,118fikm,CryptoCurrency,/r/CryptoCurrency/comments/118fikm/please_do_your_job_private_citizens_urge_judge_to/,271,,1677014710.0,"This trial is going to take years to finalize.  Don't expect the circus to end anytime soon.

LPT: You can change your Reddit setting so that anything you downvote disappears from your feed.  Make that change, then every time you come to /r/CryptoCurrency go through and downvote everything that makes you roll your eyes, then reload the page.",/r/CryptoCurrency/comments/118fikm/please_do_your_job_private_citizens_urge_judge_to/
203,‘Please Do Your Job!!!’: Private Citizens Urge Judge To Jail Bankman-Fried Before Fraud Trial,1746,118fikm,CryptoCurrency,/r/CryptoCurrency/comments/118fikm/please_do_your_job_private_citizens_urge_judge_to/,271,,1677014710.0,You underestimate the non stop appeal updates and perpetual farming attempts if he’s in jail. We won’t be done with him until he’s convicted and in jail for good.,/r/CryptoCurrency/comments/118fikm/please_do_your_job_private_citizens_urge_judge_to/
204,‘Please Do Your Job!!!’: Private Citizens Urge Judge To Jail Bankman-Fried Before Fraud Trial,1746,118fikm,CryptoCurrency,/r/CryptoCurrency/comments/118fikm/please_do_your_job_private_citizens_urge_judge_to/,271,,1677014710.0,We’d just get daily rehashed “comedy” posts about him not breaking out yet or something,/r/CryptoCurrency/comments/118fikm/please_do_your_job_private_citizens_urge_judge_to/
205,‘Please Do Your Job!!!’: Private Citizens Urge Judge To Jail Bankman-Fried Before Fraud Trial,1746,118fikm,CryptoCurrency,/r/CryptoCurrency/comments/118fikm/please_do_your_job_private_citizens_urge_judge_to/,271,,1677014710.0,"That's now the more important reason for me.

Sick of seeing his name.",/r/CryptoCurrency/comments/118fikm/please_do_your_job_private_citizens_urge_judge_to/
206,‘Please Do Your Job!!!’: Private Citizens Urge Judge To Jail Bankman-Fried Before Fraud Trial,1746,118fikm,CryptoCurrency,/r/CryptoCurrency/comments/118fikm/please_do_your_job_private_citizens_urge_judge_to/,271,,1677014710.0,Yes. It really had an impact on our KM when every article was FTX related.,/r/CryptoCurrency/comments/118fikm/please_do_your_job_private_citizens_urge_judge_to/
207,‘Please Do Your Job!!!’: Private Citizens Urge Judge To Jail Bankman-Fried Before Fraud Trial,1746,118fikm,CryptoCurrency,/r/CryptoCurrency/comments/118fikm/please_do_your_job_private_citizens_urge_judge_to/,271,,1677014710.0,"You’ll still hear about him because there will be the appeals after the trial, and then the press announcements from him/his lawyers in jail. He needs attention and he’ll make sure he gets it somehow.",/r/CryptoCurrency/comments/118fikm/please_do_your_job_private_citizens_urge_judge_to/
208,‘Please Do Your Job!!!’: Private Citizens Urge Judge To Jail Bankman-Fried Before Fraud Trial,1746,118fikm,CryptoCurrency,/r/CryptoCurrency/comments/118fikm/please_do_your_job_private_citizens_urge_judge_to/,271,,1677014710.0,I feel sick seeing his face. 🤮,/r/CryptoCurrency/comments/118fikm/please_do_your_job_private_citizens_urge_judge_to/
209,‘Please Do Your Job!!!’: Private Citizens Urge Judge To Jail Bankman-Fried Before Fraud Trial,1746,118fikm,CryptoCurrency,/r/CryptoCurrency/comments/118fikm/please_do_your_job_private_citizens_urge_judge_to/,271,,1677014710.0,"Please, he would have a jack, aka a USB cell phone or even touch screen within weeks. He'd be doing exactly what he's doing now..  more crimes. Let him stay put a bit and hang himself with his own breadcrumb trail.",/r/CryptoCurrency/comments/118fikm/please_do_your_job_private_citizens_urge_judge_to/
210,‘Please Do Your Job!!!’: Private Citizens Urge Judge To Jail Bankman-Fried Before Fraud Trial,1746,118fikm,CryptoCurrency,/r/CryptoCurrency/comments/118fikm/please_do_your_job_private_citizens_urge_judge_to/,271,,1677014710.0,For the love of all that is good and holy please get him off my feed,/r/CryptoCurrency/comments/118fikm/please_do_your_job_private_citizens_urge_judge_to/
211,‘Please Do Your Job!!!’: Private Citizens Urge Judge To Jail Bankman-Fried Before Fraud Trial,1746,118fikm,CryptoCurrency,/r/CryptoCurrency/comments/118fikm/please_do_your_job_private_citizens_urge_judge_to/,271,,1677014710.0,Sadly I have that same feeling - I Ben if convicted he could appeal and get out. This is going to be a long time until we know we’re seeing justice,/r/CryptoCurrency/comments/118fikm/please_do_your_job_private_citizens_urge_judge_to/
212,‘Please Do Your Job!!!’: Private Citizens Urge Judge To Jail Bankman-Fried Before Fraud Trial,1746,118fikm,CryptoCurrency,/r/CryptoCurrency/comments/118fikm/please_do_your_job_private_citizens_urge_judge_to/,271,,1677014710.0,At the very very least he should be there awaiting his trail. No bail for this asshole,/r/CryptoCurrency/comments/118fikm/please_do_your_job_private_citizens_urge_judge_to/
213,‘Please Do Your Job!!!’: Private Citizens Urge Judge To Jail Bankman-Fried Before Fraud Trial,1746,118fikm,CryptoCurrency,/r/CryptoCurrency/comments/118fikm/please_do_your_job_private_citizens_urge_judge_to/,271,,1677014710.0,"> Yes, in a fair world he would be in jail

In a truly fair world they wouldn’t have been scammed to begin with.

What we live in is a world far from fair.",/r/CryptoCurrency/comments/118fikm/please_do_your_job_private_citizens_urge_judge_to/
214,‘Please Do Your Job!!!’: Private Citizens Urge Judge To Jail Bankman-Fried Before Fraud Trial,1746,118fikm,CryptoCurrency,/r/CryptoCurrency/comments/118fikm/please_do_your_job_private_citizens_urge_judge_to/,271,,1677014710.0,Judge should take his entire wealth and give it back to the victims. That would be just. Plus life in prison for him with hard labour so he could pay back what he owes.,/r/CryptoCurrency/comments/118fikm/please_do_your_job_private_citizens_urge_judge_to/
215,‘Please Do Your Job!!!’: Private Citizens Urge Judge To Jail Bankman-Fried Before Fraud Trial,1746,118fikm,CryptoCurrency,/r/CryptoCurrency/comments/118fikm/please_do_your_job_private_citizens_urge_judge_to/,271,,1677014710.0,We should make a new justice system to deal with this justice system and their ugly pet sbf,/r/CryptoCurrency/comments/118fikm/please_do_your_job_private_citizens_urge_judge_to/
216,‘Please Do Your Job!!!’: Private Citizens Urge Judge To Jail Bankman-Fried Before Fraud Trial,1746,118fikm,CryptoCurrency,/r/CryptoCurrency/comments/118fikm/please_do_your_job_private_citizens_urge_judge_to/,271,,1677014710.0,He didn't give half a billion to the Democratic party for no reason.,/r/CryptoCurrency/comments/118fikm/please_do_your_job_private_citizens_urge_judge_to/
217,‘Please Do Your Job!!!’: Private Citizens Urge Judge To Jail Bankman-Fried Before Fraud Trial,1746,118fikm,CryptoCurrency,/r/CryptoCurrency/comments/118fikm/please_do_your_job_private_citizens_urge_judge_to/,271,,1677014710.0,Send them with him!,/r/CryptoCurrency/comments/118fikm/please_do_your_job_private_citizens_urge_judge_to/
218,‘Please Do Your Job!!!’: Private Citizens Urge Judge To Jail Bankman-Fried Before Fraud Trial,1746,118fikm,CryptoCurrency,/r/CryptoCurrency/comments/118fikm/please_do_your_job_private_citizens_urge_judge_to/,271,,1677014710.0,"If he’s tried in Texas or Florida maybe, no one else would have the balls",/r/CryptoCurrency/comments/118fikm/please_do_your_job_private_citizens_urge_judge_to/
219,‘Please Do Your Job!!!’: Private Citizens Urge Judge To Jail Bankman-Fried Before Fraud Trial,1746,118fikm,CryptoCurrency,/r/CryptoCurrency/comments/118fikm/please_do_your_job_private_citizens_urge_judge_to/,271,,1677014710.0,"Friends in high places - his time will come though, it’s inevitable",/r/CryptoCurrency/comments/118fikm/please_do_your_job_private_citizens_urge_judge_to/
220,‘Please Do Your Job!!!’: Private Citizens Urge Judge To Jail Bankman-Fried Before Fraud Trial,1746,118fikm,CryptoCurrency,/r/CryptoCurrency/comments/118fikm/please_do_your_job_private_citizens_urge_judge_to/,271,,1677014710.0,"Absolutely, we need to make an example out of him and any politicians that try to protect him",/r/CryptoCurrency/comments/118fikm/please_do_your_job_private_citizens_urge_judge_to/
221,‘Please Do Your Job!!!’: Private Citizens Urge Judge To Jail Bankman-Fried Before Fraud Trial,1746,118fikm,CryptoCurrency,/r/CryptoCurrency/comments/118fikm/please_do_your_job_private_citizens_urge_judge_to/,271,,1677014710.0,"Yeah they’d figure out a way to blame investors and say SBF was just a part of the problem, not the whole problem",/r/CryptoCurrency/comments/118fikm/please_do_your_job_private_citizens_urge_judge_to/
222,‘Please Do Your Job!!!’: Private Citizens Urge Judge To Jail Bankman-Fried Before Fraud Trial,1746,118fikm,CryptoCurrency,/r/CryptoCurrency/comments/118fikm/please_do_your_job_private_citizens_urge_judge_to/,271,,1677014710.0,There's no sarcasm,/r/CryptoCurrency/comments/118fikm/please_do_your_job_private_citizens_urge_judge_to/
223,‘Please Do Your Job!!!’: Private Citizens Urge Judge To Jail Bankman-Fried Before Fraud Trial,1746,118fikm,CryptoCurrency,/r/CryptoCurrency/comments/118fikm/please_do_your_job_private_citizens_urge_judge_to/,271,,1677014710.0,Always will be!,/r/CryptoCurrency/comments/118fikm/please_do_your_job_private_citizens_urge_judge_to/
224,‘Please Do Your Job!!!’: Private Citizens Urge Judge To Jail Bankman-Fried Before Fraud Trial,1746,118fikm,CryptoCurrency,/r/CryptoCurrency/comments/118fikm/please_do_your_job_private_citizens_urge_judge_to/,271,,1677014710.0,I guess so hey!,/r/CryptoCurrency/comments/118fikm/please_do_your_job_private_citizens_urge_judge_to/
225,‘Please Do Your Job!!!’: Private Citizens Urge Judge To Jail Bankman-Fried Before Fraud Trial,1746,118fikm,CryptoCurrency,/r/CryptoCurrency/comments/118fikm/please_do_your_job_private_citizens_urge_judge_to/,271,,1677014710.0,Sad but true!,/r/CryptoCurrency/comments/118fikm/please_do_your_job_private_citizens_urge_judge_to/
226,‘Please Do Your Job!!!’: Private Citizens Urge Judge To Jail Bankman-Fried Before Fraud Trial,1746,118fikm,CryptoCurrency,/r/CryptoCurrency/comments/118fikm/please_do_your_job_private_citizens_urge_judge_to/,271,,1677014710.0,"Unfortunately rules and are not the same for rich and connected people and us regular folks in this world

for them no jail, just different price tags",/r/CryptoCurrency/comments/118fikm/please_do_your_job_private_citizens_urge_judge_to/
227,‘Please Do Your Job!!!’: Private Citizens Urge Judge To Jail Bankman-Fried Before Fraud Trial,1746,118fikm,CryptoCurrency,/r/CryptoCurrency/comments/118fikm/please_do_your_job_private_citizens_urge_judge_to/,271,,1677014710.0,"America only has a legal system, not a justice system.",/r/CryptoCurrency/comments/118fikm/please_do_your_job_private_citizens_urge_judge_to/
228,‘Please Do Your Job!!!’: Private Citizens Urge Judge To Jail Bankman-Fried Before Fraud Trial,1746,118fikm,CryptoCurrency,/r/CryptoCurrency/comments/118fikm/please_do_your_job_private_citizens_urge_judge_to/,271,,1677014710.0,"Hopefully we see that change now, and his bail is revoked.

Not guaranteed, but at least the question is being raised.",/r/CryptoCurrency/comments/118fikm/please_do_your_job_private_citizens_urge_judge_to/
229,‘Please Do Your Job!!!’: Private Citizens Urge Judge To Jail Bankman-Fried Before Fraud Trial,1746,118fikm,CryptoCurrency,/r/CryptoCurrency/comments/118fikm/please_do_your_job_private_citizens_urge_judge_to/,271,,1677014710.0,That’s actually quite interesting. Good on that judge!,/r/CryptoCurrency/comments/118fikm/please_do_your_job_private_citizens_urge_judge_to/
230,‘Please Do Your Job!!!’: Private Citizens Urge Judge To Jail Bankman-Fried Before Fraud Trial,1746,118fikm,CryptoCurrency,/r/CryptoCurrency/comments/118fikm/please_do_your_job_private_citizens_urge_judge_to/,271,,1677014710.0,He's got far better 'friends' than we can imagine. Just picture how many dirty things this scumbag knows about the people in congress. I think lots of them are afraid SBF ends up opening the pandora box if he realizes it is over to him.,/r/CryptoCurrency/comments/118fikm/please_do_your_job_private_citizens_urge_judge_to/
231,‘Please Do Your Job!!!’: Private Citizens Urge Judge To Jail Bankman-Fried Before Fraud Trial,1746,118fikm,CryptoCurrency,/r/CryptoCurrency/comments/118fikm/please_do_your_job_private_citizens_urge_judge_to/,271,,1677014710.0,He may not be a lawyer or politician but he clearly knows how to play the game. Sad part is we all bought into his whole nerdy guy doing good BS. All this time we thought he was playing checkers but he was really playing chess.,/r/CryptoCurrency/comments/118fikm/please_do_your_job_private_citizens_urge_judge_to/
232,‘Please Do Your Job!!!’: Private Citizens Urge Judge To Jail Bankman-Fried Before Fraud Trial,1746,118fikm,CryptoCurrency,/r/CryptoCurrency/comments/118fikm/please_do_your_job_private_citizens_urge_judge_to/,271,,1677014710.0,But I thought he only had 100k left? /s,/r/CryptoCurrency/comments/118fikm/please_do_your_job_private_citizens_urge_judge_to/
233,‘Please Do Your Job!!!’: Private Citizens Urge Judge To Jail Bankman-Fried Before Fraud Trial,1746,118fikm,CryptoCurrency,/r/CryptoCurrency/comments/118fikm/please_do_your_job_private_citizens_urge_judge_to/,271,,1677014710.0,"Caroline's father, Gensler's old bos

Caroline's mother, Hilary's lawyer

New FTX CEO, cleaned up Enron mess

Sbf second largest donor to democrats party last elections",/r/CryptoCurrency/comments/118fikm/please_do_your_job_private_citizens_urge_judge_to/
234,‘Please Do Your Job!!!’: Private Citizens Urge Judge To Jail Bankman-Fried Before Fraud Trial,1746,118fikm,CryptoCurrency,/r/CryptoCurrency/comments/118fikm/please_do_your_job_private_citizens_urge_judge_to/,271,,1677014710.0,Probably wouldn’t take a bunch of online and phone interviews self incriminating yourself either!,/r/CryptoCurrency/comments/118fikm/please_do_your_job_private_citizens_urge_judge_to/
235,‘Please Do Your Job!!!’: Private Citizens Urge Judge To Jail Bankman-Fried Before Fraud Trial,1746,118fikm,CryptoCurrency,/r/CryptoCurrency/comments/118fikm/please_do_your_job_private_citizens_urge_judge_to/,271,,1677014710.0,Borat meme: I go to Russia!,/r/CryptoCurrency/comments/118fikm/please_do_your_job_private_citizens_urge_judge_to/
236,‘Please Do Your Job!!!’: Private Citizens Urge Judge To Jail Bankman-Fried Before Fraud Trial,1746,118fikm,CryptoCurrency,/r/CryptoCurrency/comments/118fikm/please_do_your_job_private_citizens_urge_judge_to/,271,,1677014710.0,Exactly.,/r/CryptoCurrency/comments/118fikm/please_do_your_job_private_citizens_urge_judge_to/
237,‘Please Do Your Job!!!’: Private Citizens Urge Judge To Jail Bankman-Fried Before Fraud Trial,1746,118fikm,CryptoCurrency,/r/CryptoCurrency/comments/118fikm/please_do_your_job_private_citizens_urge_judge_to/,271,,1677014710.0,Yep! Sad but true!,/r/CryptoCurrency/comments/118fikm/please_do_your_job_private_citizens_urge_judge_to/
238,‘Please Do Your Job!!!’: Private Citizens Urge Judge To Jail Bankman-Fried Before Fraud Trial,1746,118fikm,CryptoCurrency,/r/CryptoCurrency/comments/118fikm/please_do_your_job_private_citizens_urge_judge_to/,271,,1677014710.0,That’s a fair theory!,/r/CryptoCurrency/comments/118fikm/please_do_your_job_private_citizens_urge_judge_to/
239,‘Please Do Your Job!!!’: Private Citizens Urge Judge To Jail Bankman-Fried Before Fraud Trial,1746,118fikm,CryptoCurrency,/r/CryptoCurrency/comments/118fikm/please_do_your_job_private_citizens_urge_judge_to/,271,,1677014710.0,Haha I wouldn’t doubt it. SBF “donated” more money!,/r/CryptoCurrency/comments/118fikm/please_do_your_job_private_citizens_urge_judge_to/
240,‘Please Do Your Job!!!’: Private Citizens Urge Judge To Jail Bankman-Fried Before Fraud Trial,1746,118fikm,CryptoCurrency,/r/CryptoCurrency/comments/118fikm/please_do_your_job_private_citizens_urge_judge_to/,271,,1677014710.0,Yep! Can’t argue with that my friend!,/r/CryptoCurrency/comments/118fikm/please_do_your_job_private_citizens_urge_judge_to/
241,‘Please Do Your Job!!!’: Private Citizens Urge Judge To Jail Bankman-Fried Before Fraud Trial,1746,118fikm,CryptoCurrency,/r/CryptoCurrency/comments/118fikm/please_do_your_job_private_citizens_urge_judge_to/,271,,1677014710.0,True that my friend!,/r/CryptoCurrency/comments/118fikm/please_do_your_job_private_citizens_urge_judge_to/
242,‘Please Do Your Job!!!’: Private Citizens Urge Judge To Jail Bankman-Fried Before Fraud Trial,1746,118fikm,CryptoCurrency,/r/CryptoCurrency/comments/118fikm/please_do_your_job_private_citizens_urge_judge_to/,271,,1677014710.0,"and kicked in the nutz 

One kick per person, like the carnival dunk tank",/r/CryptoCurrency/comments/118fikm/please_do_your_job_private_citizens_urge_judge_to/
243,‘Please Do Your Job!!!’: Private Citizens Urge Judge To Jail Bankman-Fried Before Fraud Trial,1746,118fikm,CryptoCurrency,/r/CryptoCurrency/comments/118fikm/please_do_your_job_private_citizens_urge_judge_to/,271,,1677014710.0,"I dont, self custody is a major aspect of crypto and people need to understand that.",/r/CryptoCurrency/comments/118fikm/please_do_your_job_private_citizens_urge_judge_to/
244,‘Please Do Your Job!!!’: Private Citizens Urge Judge To Jail Bankman-Fried Before Fraud Trial,1746,118fikm,CryptoCurrency,/r/CryptoCurrency/comments/118fikm/please_do_your_job_private_citizens_urge_judge_to/,271,,1677014710.0,Honestly I wouldn't blame someone who got stolen his savings to kick this guy in the nuts as response,/r/CryptoCurrency/comments/118fikm/please_do_your_job_private_citizens_urge_judge_to/
245,‘Please Do Your Job!!!’: Private Citizens Urge Judge To Jail Bankman-Fried Before Fraud Trial,1746,118fikm,CryptoCurrency,/r/CryptoCurrency/comments/118fikm/please_do_your_job_private_citizens_urge_judge_to/,271,,1677014710.0,The justice system is a mockery itself,/r/CryptoCurrency/comments/118fikm/please_do_your_job_private_citizens_urge_judge_to/
246,‘Please Do Your Job!!!’: Private Citizens Urge Judge To Jail Bankman-Fried Before Fraud Trial,1746,118fikm,CryptoCurrency,/r/CryptoCurrency/comments/118fikm/please_do_your_job_private_citizens_urge_judge_to/,271,,1677014710.0,"We thought the same about a lot of people and they fade to background noise after a while.

What will really happen is SBF news will only die down once another person takes his place, then we get to complain about hearing their name to much",/r/CryptoCurrency/comments/118fikm/please_do_your_job_private_citizens_urge_judge_to/
247,‘Please Do Your Job!!!’: Private Citizens Urge Judge To Jail Bankman-Fried Before Fraud Trial,1746,118fikm,CryptoCurrency,/r/CryptoCurrency/comments/118fikm/please_do_your_job_private_citizens_urge_judge_to/,271,,1677014710.0,I can't say I wouldn't do the same tbh,/r/CryptoCurrency/comments/118fikm/please_do_your_job_private_citizens_urge_judge_to/
248,‘Please Do Your Job!!!’: Private Citizens Urge Judge To Jail Bankman-Fried Before Fraud Trial,1746,118fikm,CryptoCurrency,/r/CryptoCurrency/comments/118fikm/please_do_your_job_private_citizens_urge_judge_to/,271,,1677014710.0,"The funny part about it is that he is reportedly quite terrible at League of Legends.

That’s something money can’t buy, I guess.",/r/CryptoCurrency/comments/118fikm/please_do_your_job_private_citizens_urge_judge_to/
249,‘Please Do Your Job!!!’: Private Citizens Urge Judge To Jail Bankman-Fried Before Fraud Trial,1746,118fikm,CryptoCurrency,/r/CryptoCurrency/comments/118fikm/please_do_your_job_private_citizens_urge_judge_to/,271,,1677014710.0,But how will he play league of legends,/r/CryptoCurrency/comments/118fikm/please_do_your_job_private_citizens_urge_judge_to/
250,‘Please Do Your Job!!!’: Private Citizens Urge Judge To Jail Bankman-Fried Before Fraud Trial,1746,118fikm,CryptoCurrency,/r/CryptoCurrency/comments/118fikm/please_do_your_job_private_citizens_urge_judge_to/,271,,1677014710.0,"disagree, give him 1 kbs speed",/r/CryptoCurrency/comments/118fikm/please_do_your_job_private_citizens_urge_judge_to/
251,‘Please Do Your Job!!!’: Private Citizens Urge Judge To Jail Bankman-Fried Before Fraud Trial,1746,118fikm,CryptoCurrency,/r/CryptoCurrency/comments/118fikm/please_do_your_job_private_citizens_urge_judge_to/,271,,1677014710.0,"It's called ""political donations"" actually, it's the 21st century term.",/r/CryptoCurrency/comments/118fikm/please_do_your_job_private_citizens_urge_judge_to/
252,‘Please Do Your Job!!!’: Private Citizens Urge Judge To Jail Bankman-Fried Before Fraud Trial,1746,118fikm,CryptoCurrency,/r/CryptoCurrency/comments/118fikm/please_do_your_job_private_citizens_urge_judge_to/,271,,1677014710.0,Oh how he must've suffered not having his dietary preferences looked after. I'm sure he's suffered enough /s,/r/CryptoCurrency/comments/118fikm/please_do_your_job_private_citizens_urge_judge_to/
253,‘Please Do Your Job!!!’: Private Citizens Urge Judge To Jail Bankman-Fried Before Fraud Trial,1746,118fikm,CryptoCurrency,/r/CryptoCurrency/comments/118fikm/please_do_your_job_private_citizens_urge_judge_to/,271,,1677014710.0,Did Epstein himself pull an Epstein?,/r/CryptoCurrency/comments/118fikm/please_do_your_job_private_citizens_urge_judge_to/
254,‘Please Do Your Job!!!’: Private Citizens Urge Judge To Jail Bankman-Fried Before Fraud Trial,1746,118fikm,CryptoCurrency,/r/CryptoCurrency/comments/118fikm/please_do_your_job_private_citizens_urge_judge_to/,271,,1677014710.0,"True, I remember that.  But my tinfoilhat so engraved inside my head, in a case like this, I will ve taking everything with a grain of salt.

Too much money involved, some politics as well.

Theres so much we most likely don’t know.

Im just grabbing pop corn and watching it all unfold.

We shall see !",/r/CryptoCurrency/comments/118fikm/please_do_your_job_private_citizens_urge_judge_to/
255,‘Please Do Your Job!!!’: Private Citizens Urge Judge To Jail Bankman-Fried Before Fraud Trial,1746,118fikm,CryptoCurrency,/r/CryptoCurrency/comments/118fikm/please_do_your_job_private_citizens_urge_judge_to/,271,,1677014710.0,Duly noted*,/r/CryptoCurrency/comments/118fikm/please_do_your_job_private_citizens_urge_judge_to/
256,‘Please Do Your Job!!!’: Private Citizens Urge Judge To Jail Bankman-Fried Before Fraud Trial,1746,118fikm,CryptoCurrency,/r/CryptoCurrency/comments/118fikm/please_do_your_job_private_citizens_urge_judge_to/,271,,1677014710.0,In the 3rd world we call it corruption. In the 1st world we call it lobbying,/r/CryptoCurrency/comments/118fikm/please_do_your_job_private_citizens_urge_judge_to/
257,‘Please Do Your Job!!!’: Private Citizens Urge Judge To Jail Bankman-Fried Before Fraud Trial,1746,118fikm,CryptoCurrency,/r/CryptoCurrency/comments/118fikm/please_do_your_job_private_citizens_urge_judge_to/,271,,1677014710.0,Truth have been said here.,/r/CryptoCurrency/comments/118fikm/please_do_your_job_private_citizens_urge_judge_to/
