,title,score,id,subreddit,url,num_comments,body,created,comments,post_url
137,‘Please Do Your Job!!!’: Private Citizens Urge Judge To Jail Bankman-Fried Before Fraud Trial,1746,118fikm,CryptoCurrency,/r/CryptoCurrency/comments/118fikm/please_do_your_job_private_citizens_urge_judge_to/,271,,1677014710.0,His corrupt politicians friends are the reason he isn't jailed for good unfortunately,/r/CryptoCurrency/comments/118fikm/please_do_your_job_private_citizens_urge_judge_to/
138,‘Please Do Your Job!!!’: Private Citizens Urge Judge To Jail Bankman-Fried Before Fraud Trial,1746,118fikm,CryptoCurrency,/r/CryptoCurrency/comments/118fikm/please_do_your_job_private_citizens_urge_judge_to/,271,,1677014710.0,I doubt many people here would disagree with you on that one,/r/CryptoCurrency/comments/118fikm/please_do_your_job_private_citizens_urge_judge_to/
139,‘Please Do Your Job!!!’: Private Citizens Urge Judge To Jail Bankman-Fried Before Fraud Trial,1746,118fikm,CryptoCurrency,/r/CryptoCurrency/comments/118fikm/please_do_your_job_private_citizens_urge_judge_to/,271,,1677014710.0,"Or executed. The only thing the US could do right that the rest of the world couldn't.

Then again, it has the highest levels of corruption, er, lobbyism in the world, so, GG.",/r/CryptoCurrency/comments/118fikm/please_do_your_job_private_citizens_urge_judge_to/
140,‘Please Do Your Job!!!’: Private Citizens Urge Judge To Jail Bankman-Fried Before Fraud Trial,1746,118fikm,CryptoCurrency,/r/CryptoCurrency/comments/118fikm/please_do_your_job_private_citizens_urge_judge_to/,271,,1677014710.0,I wish he would be in jail for whole life time.,/r/CryptoCurrency/comments/118fikm/please_do_your_job_private_citizens_urge_judge_to/
141,‘Please Do Your Job!!!’: Private Citizens Urge Judge To Jail Bankman-Fried Before Fraud Trial,1746,118fikm,CryptoCurrency,/r/CryptoCurrency/comments/118fikm/please_do_your_job_private_citizens_urge_judge_to/,271,,1677014710.0,It’s crazy that he is not!,/r/CryptoCurrency/comments/118fikm/please_do_your_job_private_citizens_urge_judge_to/
142,‘Please Do Your Job!!!’: Private Citizens Urge Judge To Jail Bankman-Fried Before Fraud Trial,1746,118fikm,CryptoCurrency,/r/CryptoCurrency/comments/118fikm/please_do_your_job_private_citizens_urge_judge_to/,271,,1677014710.0,it would be best if he'd be going to Epstein street,/r/CryptoCurrency/comments/118fikm/please_do_your_job_private_citizens_urge_judge_to/
143,‘Please Do Your Job!!!’: Private Citizens Urge Judge To Jail Bankman-Fried Before Fraud Trial,1746,118fikm,CryptoCurrency,/r/CryptoCurrency/comments/118fikm/please_do_your_job_private_citizens_urge_judge_to/,271,,1677014710.0,People would lose their minds if he went away.,/r/CryptoCurrency/comments/118fikm/please_do_your_job_private_citizens_urge_judge_to/
144,‘Please Do Your Job!!!’: Private Citizens Urge Judge To Jail Bankman-Fried Before Fraud Trial,1746,118fikm,CryptoCurrency,/r/CryptoCurrency/comments/118fikm/please_do_your_job_private_citizens_urge_judge_to/,271,,1677014710.0,*Rotting in jail,/r/CryptoCurrency/comments/118fikm/please_do_your_job_private_citizens_urge_judge_to/
145,‘Please Do Your Job!!!’: Private Citizens Urge Judge To Jail Bankman-Fried Before Fraud Trial,1746,118fikm,CryptoCurrency,/r/CryptoCurrency/comments/118fikm/please_do_your_job_private_citizens_urge_judge_to/,271,,1677014710.0,It would be better for all of human civilization,/r/CryptoCurrency/comments/118fikm/please_do_your_job_private_citizens_urge_judge_to/
146,‘Please Do Your Job!!!’: Private Citizens Urge Judge To Jail Bankman-Fried Before Fraud Trial,1746,118fikm,CryptoCurrency,/r/CryptoCurrency/comments/118fikm/please_do_your_job_private_citizens_urge_judge_to/,271,,1677014710.0,"Yes, sooner the better, it will deter other scammers too.",/r/CryptoCurrency/comments/118fikm/please_do_your_job_private_citizens_urge_judge_to/
147,‘Please Do Your Job!!!’: Private Citizens Urge Judge To Jail Bankman-Fried Before Fraud Trial,1746,118fikm,CryptoCurrency,/r/CryptoCurrency/comments/118fikm/please_do_your_job_private_citizens_urge_judge_to/,271,,1677014710.0,"I bet if it happened, we'd have a rally just based on that news.",/r/CryptoCurrency/comments/118fikm/please_do_your_job_private_citizens_urge_judge_to/
148,‘Please Do Your Job!!!’: Private Citizens Urge Judge To Jail Bankman-Fried Before Fraud Trial,1746,118fikm,CryptoCurrency,/r/CryptoCurrency/comments/118fikm/please_do_your_job_private_citizens_urge_judge_to/,271,,1677014710.0,Itll be like Christmas when that day comes,/r/CryptoCurrency/comments/118fikm/please_do_your_job_private_citizens_urge_judge_to/
149,‘Please Do Your Job!!!’: Private Citizens Urge Judge To Jail Bankman-Fried Before Fraud Trial,1746,118fikm,CryptoCurrency,/r/CryptoCurrency/comments/118fikm/please_do_your_job_private_citizens_urge_judge_to/,271,,1677014710.0,"SBF, suspected of stealing billions and FTX funds mysteriously being transferred out recently: *'Oh yeah, let's let him sit at home, use his Internet to do god knows what and contact witnesses!'*

Tornado Cash guy, who simply created a code: *'Bail?! DENIED! This guy is a major threat to everyone! Rot in jail for as long as possible!'*",/r/CryptoCurrency/comments/118fikm/please_do_your_job_private_citizens_urge_judge_to/
150,‘Please Do Your Job!!!’: Private Citizens Urge Judge To Jail Bankman-Fried Before Fraud Trial,1746,118fikm,CryptoCurrency,/r/CryptoCurrency/comments/118fikm/please_do_your_job_private_citizens_urge_judge_to/,271,,1677014710.0,Comment is missing angry 😡 /s,/r/CryptoCurrency/comments/118fikm/please_do_your_job_private_citizens_urge_judge_to/
151,‘Please Do Your Job!!!’: Private Citizens Urge Judge To Jail Bankman-Fried Before Fraud Trial,1746,118fikm,CryptoCurrency,/r/CryptoCurrency/comments/118fikm/please_do_your_job_private_citizens_urge_judge_to/,271,,1677014710.0,"Telling someone to ""do their job"" whilst they do what they're *actually* paid for is irony at its greatest.

Its like telling a janitor to ""clean this mess"" while the janitor is mopping up the vomit in the institution paying their salary...",/r/CryptoCurrency/comments/118fikm/please_do_your_job_private_citizens_urge_judge_to/
152,‘Please Do Your Job!!!’: Private Citizens Urge Judge To Jail Bankman-Fried Before Fraud Trial,1746,118fikm,CryptoCurrency,/r/CryptoCurrency/comments/118fikm/please_do_your_job_private_citizens_urge_judge_to/,271,,1677014710.0,I wish this wasn't so accurate..,/r/CryptoCurrency/comments/118fikm/please_do_your_job_private_citizens_urge_judge_to/
153,‘Please Do Your Job!!!’: Private Citizens Urge Judge To Jail Bankman-Fried Before Fraud Trial,1746,118fikm,CryptoCurrency,/r/CryptoCurrency/comments/118fikm/please_do_your_job_private_citizens_urge_judge_to/,271,,1677014710.0,Its disappointing how true that is,/r/CryptoCurrency/comments/118fikm/please_do_your_job_private_citizens_urge_judge_to/
154,‘Please Do Your Job!!!’: Private Citizens Urge Judge To Jail Bankman-Fried Before Fraud Trial,1746,118fikm,CryptoCurrency,/r/CryptoCurrency/comments/118fikm/please_do_your_job_private_citizens_urge_judge_to/,271,,1677014710.0,So sad reality these days. The rich and powerful criminals get away with the shady stuff they do.,/r/CryptoCurrency/comments/118fikm/please_do_your_job_private_citizens_urge_judge_to/
155,‘Please Do Your Job!!!’: Private Citizens Urge Judge To Jail Bankman-Fried Before Fraud Trial,1746,118fikm,CryptoCurrency,/r/CryptoCurrency/comments/118fikm/please_do_your_job_private_citizens_urge_judge_to/,271,,1677014710.0,It's enraging seeing them get away with it,/r/CryptoCurrency/comments/118fikm/please_do_your_job_private_citizens_urge_judge_to/
156,‘Please Do Your Job!!!’: Private Citizens Urge Judge To Jail Bankman-Fried Before Fraud Trial,1746,118fikm,CryptoCurrency,/r/CryptoCurrency/comments/118fikm/please_do_your_job_private_citizens_urge_judge_to/,271,,1677014710.0,">The justice system is fucked. 

Always has been",/r/CryptoCurrency/comments/118fikm/please_do_your_job_private_citizens_urge_judge_to/
157,‘Please Do Your Job!!!’: Private Citizens Urge Judge To Jail Bankman-Fried Before Fraud Trial,1746,118fikm,CryptoCurrency,/r/CryptoCurrency/comments/118fikm/please_do_your_job_private_citizens_urge_judge_to/,271,,1677014710.0,"“Steal a little and they throw in you jail, steal a lot and they make you king.”",/r/CryptoCurrency/comments/118fikm/please_do_your_job_private_citizens_urge_judge_to/
158,‘Please Do Your Job!!!’: Private Citizens Urge Judge To Jail Bankman-Fried Before Fraud Trial,1746,118fikm,CryptoCurrency,/r/CryptoCurrency/comments/118fikm/please_do_your_job_private_citizens_urge_judge_to/,271,,1677014710.0,Rules for thee and not for me!,/r/CryptoCurrency/comments/118fikm/please_do_your_job_private_citizens_urge_judge_to/
159,‘Please Do Your Job!!!’: Private Citizens Urge Judge To Jail Bankman-Fried Before Fraud Trial,1746,118fikm,CryptoCurrency,/r/CryptoCurrency/comments/118fikm/please_do_your_job_private_citizens_urge_judge_to/,271,,1677014710.0,The initial judge on his case recused themself for possible conflict of interest. This second one should be able to at least hold him accountable to the bare minimum standards of someone awaiting trial,/r/CryptoCurrency/comments/118fikm/please_do_your_job_private_citizens_urge_judge_to/
160,‘Please Do Your Job!!!’: Private Citizens Urge Judge To Jail Bankman-Fried Before Fraud Trial,1746,118fikm,CryptoCurrency,/r/CryptoCurrency/comments/118fikm/please_do_your_job_private_citizens_urge_judge_to/,271,,1677014710.0,"He have crazy connections and that is well known. Both his parents are law professors at Stanford, random people do not get such positions. Also their family have very close ties to many US senators, so he is not some random guy.",/r/CryptoCurrency/comments/118fikm/please_do_your_job_private_citizens_urge_judge_to/
161,‘Please Do Your Job!!!’: Private Citizens Urge Judge To Jail Bankman-Fried Before Fraud Trial,1746,118fikm,CryptoCurrency,/r/CryptoCurrency/comments/118fikm/please_do_your_job_private_citizens_urge_judge_to/,271,,1677014710.0,his political connection is money,/r/CryptoCurrency/comments/118fikm/please_do_your_job_private_citizens_urge_judge_to/
162,‘Please Do Your Job!!!’: Private Citizens Urge Judge To Jail Bankman-Fried Before Fraud Trial,1746,118fikm,CryptoCurrency,/r/CryptoCurrency/comments/118fikm/please_do_your_job_private_citizens_urge_judge_to/,271,,1677014710.0,"You’re right, if I stole billions of dollars, you’d never see me again. Because I’d change my identity then peace out to a country that doesn’t have an extradition treaty with my home country.",/r/CryptoCurrency/comments/118fikm/please_do_your_job_private_citizens_urge_judge_to/
163,‘Please Do Your Job!!!’: Private Citizens Urge Judge To Jail Bankman-Fried Before Fraud Trial,1746,118fikm,CryptoCurrency,/r/CryptoCurrency/comments/118fikm/please_do_your_job_private_citizens_urge_judge_to/,271,,1677014710.0,"I don't think we'd disappear, but our freedom sure as hell would. And no bunking with mom and dad until judgement day",/r/CryptoCurrency/comments/118fikm/please_do_your_job_private_citizens_urge_judge_to/
164,‘Please Do Your Job!!!’: Private Citizens Urge Judge To Jail Bankman-Fried Before Fraud Trial,1746,118fikm,CryptoCurrency,/r/CryptoCurrency/comments/118fikm/please_do_your_job_private_citizens_urge_judge_to/,271,,1677014710.0,">This man had some serious political connections.

When you tend to donate tens of millions of dollars to politicians, that comes attached with a lot of pull and networking.",/r/CryptoCurrency/comments/118fikm/please_do_your_job_private_citizens_urge_judge_to/
165,‘Please Do Your Job!!!’: Private Citizens Urge Judge To Jail Bankman-Fried Before Fraud Trial,1746,118fikm,CryptoCurrency,/r/CryptoCurrency/comments/118fikm/please_do_your_job_private_citizens_urge_judge_to/,271,,1677014710.0,"Totally fucked and split in two. One for rich people and one for ordinary people. 

Both don't get justice. Rich people typically get away with it and ordinary people can't get away from it.",/r/CryptoCurrency/comments/118fikm/please_do_your_job_private_citizens_urge_judge_to/
166,‘Please Do Your Job!!!’: Private Citizens Urge Judge To Jail Bankman-Fried Before Fraud Trial,1746,118fikm,CryptoCurrency,/r/CryptoCurrency/comments/118fikm/please_do_your_job_private_citizens_urge_judge_to/,271,,1677014710.0,"The reason he's still alive is that he's hidden most of it. If there's a chance some elites can get their money back, they'll do everything they can to make sure he doesn't do hard time, so they can get it back.",/r/CryptoCurrency/comments/118fikm/please_do_your_job_private_citizens_urge_judge_to/
167,‘Please Do Your Job!!!’: Private Citizens Urge Judge To Jail Bankman-Fried Before Fraud Trial,1746,118fikm,CryptoCurrency,/r/CryptoCurrency/comments/118fikm/please_do_your_job_private_citizens_urge_judge_to/,271,,1677014710.0,And the US financial system is rigged and fucked for the .1%,/r/CryptoCurrency/comments/118fikm/please_do_your_job_private_citizens_urge_judge_to/
168,‘Please Do Your Job!!!’: Private Citizens Urge Judge To Jail Bankman-Fried Before Fraud Trial,1746,118fikm,CryptoCurrency,/r/CryptoCurrency/comments/118fikm/please_do_your_job_private_citizens_urge_judge_to/,271,,1677014710.0,"Didn’t the tornado cash guy get denied bail recently?

While SBF who stole billions is sitting at home, using Internet and contacting witnesses. What a joke the system is!",/r/CryptoCurrency/comments/118fikm/please_do_your_job_private_citizens_urge_judge_to/
169,‘Please Do Your Job!!!’: Private Citizens Urge Judge To Jail Bankman-Fried Before Fraud Trial,1746,118fikm,CryptoCurrency,/r/CryptoCurrency/comments/118fikm/please_do_your_job_private_citizens_urge_judge_to/,271,,1677014710.0,">The justice system is fucked.

""Justice system"". Once you realize this system is all smoke and mirrors it'll all make sense.",/r/CryptoCurrency/comments/118fikm/please_do_your_job_private_citizens_urge_judge_to/
170,‘Please Do Your Job!!!’: Private Citizens Urge Judge To Jail Bankman-Fried Before Fraud Trial,1746,118fikm,CryptoCurrency,/r/CryptoCurrency/comments/118fikm/please_do_your_job_private_citizens_urge_judge_to/,271,,1677014710.0,"If you steel $10k you'd be fucked and put directly in prison, rich people getting off way to easily",/r/CryptoCurrency/comments/118fikm/please_do_your_job_private_citizens_urge_judge_to/
171,‘Please Do Your Job!!!’: Private Citizens Urge Judge To Jail Bankman-Fried Before Fraud Trial,1746,118fikm,CryptoCurrency,/r/CryptoCurrency/comments/118fikm/please_do_your_job_private_citizens_urge_judge_to/,271,,1677014710.0,SBF is fucking system of justice.,/r/CryptoCurrency/comments/118fikm/please_do_your_job_private_citizens_urge_judge_to/
172,‘Please Do Your Job!!!’: Private Citizens Urge Judge To Jail Bankman-Fried Before Fraud Trial,1746,118fikm,CryptoCurrency,/r/CryptoCurrency/comments/118fikm/please_do_your_job_private_citizens_urge_judge_to/,271,,1677014710.0,"Just one, Kenneth Cordarelle Griffin",/r/CryptoCurrency/comments/118fikm/please_do_your_job_private_citizens_urge_judge_to/
173,‘Please Do Your Job!!!’: Private Citizens Urge Judge To Jail Bankman-Fried Before Fraud Trial,1746,118fikm,CryptoCurrency,/r/CryptoCurrency/comments/118fikm/please_do_your_job_private_citizens_urge_judge_to/,271,,1677014710.0,"“This guy hasn’t been extrajudicially murdered yet, therefore the justice system is fucked” is an interesting take.",/r/CryptoCurrency/comments/118fikm/please_do_your_job_private_citizens_urge_judge_to/
174,‘Please Do Your Job!!!’: Private Citizens Urge Judge To Jail Bankman-Fried Before Fraud Trial,1746,118fikm,CryptoCurrency,/r/CryptoCurrency/comments/118fikm/please_do_your_job_private_citizens_urge_judge_to/,271,,1677014710.0,So ridiculous. I’m not a victim of FTX but I really feel for those lost their money for this disaster. SBF needs to be jailed.,/r/CryptoCurrency/comments/118fikm/please_do_your_job_private_citizens_urge_judge_to/
175,‘Please Do Your Job!!!’: Private Citizens Urge Judge To Jail Bankman-Fried Before Fraud Trial,1746,118fikm,CryptoCurrency,/r/CryptoCurrency/comments/118fikm/please_do_your_job_private_citizens_urge_judge_to/,271,,1677014710.0,Imagine being a victim of this guy's scam and finding out the judge is letting him stay in his parent's luxurious home with access to a VPN so he can move and hide any hidden wallets he still had.,/r/CryptoCurrency/comments/118fikm/please_do_your_job_private_citizens_urge_judge_to/
176,‘Please Do Your Job!!!’: Private Citizens Urge Judge To Jail Bankman-Fried Before Fraud Trial,1746,118fikm,CryptoCurrency,/r/CryptoCurrency/comments/118fikm/please_do_your_job_private_citizens_urge_judge_to/,271,,1677014710.0,Need to kick his (SBF) nuts if he has any.,/r/CryptoCurrency/comments/118fikm/please_do_your_job_private_citizens_urge_judge_to/
177,‘Please Do Your Job!!!’: Private Citizens Urge Judge To Jail Bankman-Fried Before Fraud Trial,1746,118fikm,CryptoCurrency,/r/CryptoCurrency/comments/118fikm/please_do_your_job_private_citizens_urge_judge_to/,271,,1677014710.0,"Honest opinion: I don't feel sorry for them at all. We were pleading with them to hold their own coins the whole time, and they wouldn't listen. They destabilized the crypto economy and made us all look like fools to the general public, all because they couldn't be bothered to learn key storage before pursuing quick riches.

Most of them will still even trust a counterparty again, as we saw after MtGox. So the ""kick"" must not hurt so much.",/r/CryptoCurrency/comments/118fikm/please_do_your_job_private_citizens_urge_judge_to/
178,‘Please Do Your Job!!!’: Private Citizens Urge Judge To Jail Bankman-Fried Before Fraud Trial,1746,118fikm,CryptoCurrency,/r/CryptoCurrency/comments/118fikm/please_do_your_job_private_citizens_urge_judge_to/,271,,1677014710.0,The fact that he mocks the justice system again and again and the judges themselves keep giving him more chances is a travesty,/r/CryptoCurrency/comments/118fikm/please_do_your_job_private_citizens_urge_judge_to/
179,‘Please Do Your Job!!!’: Private Citizens Urge Judge To Jail Bankman-Fried Before Fraud Trial,1746,118fikm,CryptoCurrency,/r/CryptoCurrency/comments/118fikm/please_do_your_job_private_citizens_urge_judge_to/,271,,1677014710.0,"Again, this whole time we thought he was playing checkers but he was really playing chess. He knows the game...",/r/CryptoCurrency/comments/118fikm/please_do_your_job_private_citizens_urge_judge_to/
180,‘Please Do Your Job!!!’: Private Citizens Urge Judge To Jail Bankman-Fried Before Fraud Trial,1746,118fikm,CryptoCurrency,/r/CryptoCurrency/comments/118fikm/please_do_your_job_private_citizens_urge_judge_to/,271,,1677014710.0,He still don't give a fuck to the system of justice. He should be in jail.,/r/CryptoCurrency/comments/118fikm/please_do_your_job_private_citizens_urge_judge_to/
181,‘Please Do Your Job!!!’: Private Citizens Urge Judge To Jail Bankman-Fried Before Fraud Trial,1746,118fikm,CryptoCurrency,/r/CryptoCurrency/comments/118fikm/please_do_your_job_private_citizens_urge_judge_to/,271,,1677014710.0,I can’t wait to stop hearing about SBF. The reality is that his name will keep popping up for years…,/r/CryptoCurrency/comments/118fikm/please_do_your_job_private_citizens_urge_judge_to/
182,‘Please Do Your Job!!!’: Private Citizens Urge Judge To Jail Bankman-Fried Before Fraud Trial,1746,118fikm,CryptoCurrency,/r/CryptoCurrency/comments/118fikm/please_do_your_job_private_citizens_urge_judge_to/,271,,1677014710.0,Fucker would snug a router in his ass into a gulag just so he can keep playing league of legends,/r/CryptoCurrency/comments/118fikm/please_do_your_job_private_citizens_urge_judge_to/
183,‘Please Do Your Job!!!’: Private Citizens Urge Judge To Jail Bankman-Fried Before Fraud Trial,1746,118fikm,CryptoCurrency,/r/CryptoCurrency/comments/118fikm/please_do_your_job_private_citizens_urge_judge_to/,271,,1677014710.0,Agreed. I really hate his face. He should be jailed asap.,/r/CryptoCurrency/comments/118fikm/please_do_your_job_private_citizens_urge_judge_to/
184,‘Please Do Your Job!!!’: Private Citizens Urge Judge To Jail Bankman-Fried Before Fraud Trial,1746,118fikm,CryptoCurrency,/r/CryptoCurrency/comments/118fikm/please_do_your_job_private_citizens_urge_judge_to/,271,,1677014710.0,Sick of spam bankman free at this point yeah,/r/CryptoCurrency/comments/118fikm/please_do_your_job_private_citizens_urge_judge_to/
185,‘Please Do Your Job!!!’: Private Citizens Urge Judge To Jail Bankman-Fried Before Fraud Trial,1746,118fikm,CryptoCurrency,/r/CryptoCurrency/comments/118fikm/please_do_your_job_private_citizens_urge_judge_to/,271,,1677014710.0,Ideally somewhere without access to the internet.,/r/CryptoCurrency/comments/118fikm/please_do_your_job_private_citizens_urge_judge_to/
186,‘Please Do Your Job!!!’: Private Citizens Urge Judge To Jail Bankman-Fried Before Fraud Trial,1746,118fikm,CryptoCurrency,/r/CryptoCurrency/comments/118fikm/please_do_your_job_private_citizens_urge_judge_to/,271,,1677014710.0,We are tired of SBF bullshit news. Please put him jail asap.,/r/CryptoCurrency/comments/118fikm/please_do_your_job_private_citizens_urge_judge_to/
187,‘Please Do Your Job!!!’: Private Citizens Urge Judge To Jail Bankman-Fried Before Fraud Trial,1746,118fikm,CryptoCurrency,/r/CryptoCurrency/comments/118fikm/please_do_your_job_private_citizens_urge_judge_to/,271,,1677014710.0,Hearing about him often can be viewed as either a good thing or a bad thing. It's a constant slap in the face to those who would have suffered financially and emotionally but also a reminder that we should never ever take people's word as gospel. Thieves and liars exist in all shapes and forms. We must always be vigilant and skeptical.,/r/CryptoCurrency/comments/118fikm/please_do_your_job_private_citizens_urge_judge_to/
188,‘Please Do Your Job!!!’: Private Citizens Urge Judge To Jail Bankman-Fried Before Fraud Trial,1746,118fikm,CryptoCurrency,/r/CryptoCurrency/comments/118fikm/please_do_your_job_private_citizens_urge_judge_to/,271,,1677014710.0,*SBF tries to bribe guards to smuggle phone into cell*,/r/CryptoCurrency/comments/118fikm/please_do_your_job_private_citizens_urge_judge_to/
189,‘Please Do Your Job!!!’: Private Citizens Urge Judge To Jail Bankman-Fried Before Fraud Trial,1746,118fikm,CryptoCurrency,/r/CryptoCurrency/comments/118fikm/please_do_your_job_private_citizens_urge_judge_to/,271,,1677014710.0,Fraud billions of dollar but he is still outside jail. What a joke to system of judicial.,/r/CryptoCurrency/comments/118fikm/please_do_your_job_private_citizens_urge_judge_to/
190,‘Please Do Your Job!!!’: Private Citizens Urge Judge To Jail Bankman-Fried Before Fraud Trial,1746,118fikm,CryptoCurrency,/r/CryptoCurrency/comments/118fikm/please_do_your_job_private_citizens_urge_judge_to/,271,,1677014710.0,"Trial is in October only.. Fuck me, that is a long wait",/r/CryptoCurrency/comments/118fikm/please_do_your_job_private_citizens_urge_judge_to/
191,‘Please Do Your Job!!!’: Private Citizens Urge Judge To Jail Bankman-Fried Before Fraud Trial,1746,118fikm,CryptoCurrency,/r/CryptoCurrency/comments/118fikm/please_do_your_job_private_citizens_urge_judge_to/,271,,1677014710.0,"Agreed.

However financial fraud cases take a long time, a very long time.

If he remains on bail, a sentence could take 5+ years to come down.",/r/CryptoCurrency/comments/118fikm/please_do_your_job_private_citizens_urge_judge_to/
192,‘Please Do Your Job!!!’: Private Citizens Urge Judge To Jail Bankman-Fried Before Fraud Trial,1746,118fikm,CryptoCurrency,/r/CryptoCurrency/comments/118fikm/please_do_your_job_private_citizens_urge_judge_to/,271,,1677014710.0,We had headlines about him still while he was in Bahamas jail and it was mostly about him not getting vegan food.,/r/CryptoCurrency/comments/118fikm/please_do_your_job_private_citizens_urge_judge_to/
193,‘Please Do Your Job!!!’: Private Citizens Urge Judge To Jail Bankman-Fried Before Fraud Trial,1746,118fikm,CryptoCurrency,/r/CryptoCurrency/comments/118fikm/please_do_your_job_private_citizens_urge_judge_to/,271,,1677014710.0,Unless he pulls an Epstein,/r/CryptoCurrency/comments/118fikm/please_do_your_job_private_citizens_urge_judge_to/
194,‘Please Do Your Job!!!’: Private Citizens Urge Judge To Jail Bankman-Fried Before Fraud Trial,1746,118fikm,CryptoCurrency,/r/CryptoCurrency/comments/118fikm/please_do_your_job_private_citizens_urge_judge_to/,271,,1677014710.0,Im sure he'd find a way,/r/CryptoCurrency/comments/118fikm/please_do_your_job_private_citizens_urge_judge_to/
195,‘Please Do Your Job!!!’: Private Citizens Urge Judge To Jail Bankman-Fried Before Fraud Trial,1746,118fikm,CryptoCurrency,/r/CryptoCurrency/comments/118fikm/please_do_your_job_private_citizens_urge_judge_to/,271,,1677014710.0,"The judge that originally signed off on his bail recused herself right after because she knew his parents and thought it was a conflict of interest.  
  
Why not before the bail?",/r/CryptoCurrency/comments/118fikm/please_do_your_job_private_citizens_urge_judge_to/
196,‘Please Do Your Job!!!’: Private Citizens Urge Judge To Jail Bankman-Fried Before Fraud Trial,1746,118fikm,CryptoCurrency,/r/CryptoCurrency/comments/118fikm/please_do_your_job_private_citizens_urge_judge_to/,271,,1677014710.0,Political donations are basically legalised bribes.,/r/CryptoCurrency/comments/118fikm/please_do_your_job_private_citizens_urge_judge_to/
