,title,score,id,subreddit,url,num_comments,body,created,comments,post_url
0,Hodl 👏,428,117sh93,Bitcoin,/r/Bitcoin/comments/117sh93/hodl/,40,,1676948008.0,You’re a “ho” on the “dl”.,/r/Bitcoin/comments/117sh93/hodl/
1,Hodl 👏,428,117sh93,Bitcoin,/r/Bitcoin/comments/117sh93/hodl/,40,,1676948008.0,"“you got to know when hodl’em, know when to sodl’em, know when to walk away and know when to run”",/r/Bitcoin/comments/117sh93/hodl/
2,Hodl 👏,428,117sh93,Bitcoin,/r/Bitcoin/comments/117sh93/hodl/,40,,1676948008.0,"When you read this comment, you will have good luck.",/r/Bitcoin/comments/117sh93/hodl/
3,Hodl 👏,428,117sh93,Bitcoin,/r/Bitcoin/comments/117sh93/hodl/,40,,1676948008.0,Oh I like this,/r/Bitcoin/comments/117sh93/hodl/
4,Hodl 👏,428,117sh93,Bitcoin,/r/Bitcoin/comments/117sh93/hodl/,40,,1676948008.0,"So basically what you’re saying (and your cards) is don’t gamble that Bitcoin on the table. Fold every time? But then you lose the ante. Doesn’t really make sense. 

But yeah, hodl.",/r/Bitcoin/comments/117sh93/hodl/
5,Hodl 👏,428,117sh93,Bitcoin,/r/Bitcoin/comments/117sh93/hodl/,40,,1676948008.0,"It's not a poker game, thank you.",/r/Bitcoin/comments/117sh93/hodl/
6,Hodl 👏,428,117sh93,Bitcoin,/r/Bitcoin/comments/117sh93/hodl/,40,,1676948008.0,!lntip 500,/r/Bitcoin/comments/117sh93/hodl/
7,Hodl 👏,428,117sh93,Bitcoin,/r/Bitcoin/comments/117sh93/hodl/,40,,1676948008.0,"[https://youtu.be/4tyuLSGpFp8](https://youtu.be/4tyuLSGpFp8)  


Bitcoin Explained\^\^",/r/Bitcoin/comments/117sh93/hodl/
8,Hodl 👏,428,117sh93,Bitcoin,/r/Bitcoin/comments/117sh93/hodl/,40,,1676948008.0,"the perfect card is given, better trust it",/r/Bitcoin/comments/117sh93/hodl/
9,Hodl 👏,428,117sh93,Bitcoin,/r/Bitcoin/comments/117sh93/hodl/,40,,1676948008.0,Or take some profits if you DCA-d sub 20k. Nothing wrong with that.,/r/Bitcoin/comments/117sh93/hodl/
10,Hodl 👏,428,117sh93,Bitcoin,/r/Bitcoin/comments/117sh93/hodl/,40,,1676948008.0,Ho down low,/r/Bitcoin/comments/117sh93/hodl/
11,Hodl 👏,428,117sh93,Bitcoin,/r/Bitcoin/comments/117sh93/hodl/,40,,1676948008.0,panicsell panicsell,/r/Bitcoin/comments/117sh93/hodl/
12,Hodl 👏,428,117sh93,Bitcoin,/r/Bitcoin/comments/117sh93/hodl/,40,,1676948008.0,This awesome. Who's the artist?,/r/Bitcoin/comments/117sh93/hodl/
13,Hodl 👏,428,117sh93,Bitcoin,/r/Bitcoin/comments/117sh93/hodl/,40,,1676948008.0,"I've never seen a ""HO"" and ""DL"" card. Must be fake..",/r/Bitcoin/comments/117sh93/hodl/
14,Hodl 👏,428,117sh93,Bitcoin,/r/Bitcoin/comments/117sh93/hodl/,40,,1676948008.0,"So it’s literally gambling? Jesus Christ, that’s retarded.",/r/Bitcoin/comments/117sh93/hodl/
15,Hodl 👏,428,117sh93,Bitcoin,/r/Bitcoin/comments/117sh93/hodl/,40,,1676948008.0,I am man I am,/r/Bitcoin/comments/117sh93/hodl/
16,Hodl 👏,428,117sh93,Bitcoin,/r/Bitcoin/comments/117sh93/hodl/,40,,1676948008.0,The Hodl mentality will be the death of Bitcoin. And Carol Baskins is still a bitch.,/r/Bitcoin/comments/117sh93/hodl/
17,Hodl 👏,428,117sh93,Bitcoin,/r/Bitcoin/comments/117sh93/hodl/,40,,1676948008.0,"Copied and using for my wallpaper, thanks!",/r/Bitcoin/comments/117sh93/hodl/
18,Hodl 👏,428,117sh93,Bitcoin,/r/Bitcoin/comments/117sh93/hodl/,40,,1676948008.0,This is nice. I like this.,/r/Bitcoin/comments/117sh93/hodl/
19,Hodl 👏,428,117sh93,Bitcoin,/r/Bitcoin/comments/117sh93/hodl/,40,,1676948008.0,"Buy, HODL, Repeat. Easy pattern to remember :)",/r/Bitcoin/comments/117sh93/hodl/
20,Hodl 👏,428,117sh93,Bitcoin,/r/Bitcoin/comments/117sh93/hodl/,40,,1676948008.0, You will be lucky if you read this comment.,/r/Bitcoin/comments/117sh93/hodl/
21,Hodl 👏,428,117sh93,Bitcoin,/r/Bitcoin/comments/117sh93/hodl/,40,,1676948008.0,Hodling like my life depends on it.,/r/Bitcoin/comments/117sh93/hodl/
22,Hodl 👏,428,117sh93,Bitcoin,/r/Bitcoin/comments/117sh93/hodl/,40,,1676948008.0,Long,/r/Bitcoin/comments/117sh93/hodl/
23,Hodl 👏,428,117sh93,Bitcoin,/r/Bitcoin/comments/117sh93/hodl/,40,,1676948008.0,AK.,/r/Bitcoin/comments/117sh93/hodl/
24,Hodl 👏,428,117sh93,Bitcoin,/r/Bitcoin/comments/117sh93/hodl/,40,,1676948008.0,BTC to 1 million!,/r/Bitcoin/comments/117sh93/hodl/
25,Hodl 👏,428,117sh93,Bitcoin,/r/Bitcoin/comments/117sh93/hodl/,40,,1676948008.0,I wonder how many read this as “ho” on the “dl” 🧐,/r/Bitcoin/comments/117sh93/hodl/
26,Hodl 👏,428,117sh93,Bitcoin,/r/Bitcoin/comments/117sh93/hodl/,40,,1676948008.0,At least you can admit you're gambling,/r/Bitcoin/comments/117sh93/hodl/
27,Hodl 👏,428,117sh93,Bitcoin,/r/Bitcoin/comments/117sh93/hodl/,40,,1676948008.0,"Абе BUY направо, к'во HODL... 😀",/r/Bitcoin/comments/117sh93/hodl/
28,Hodl 👏,428,117sh93,Bitcoin,/r/Bitcoin/comments/117sh93/hodl/,40,,1676948008.0,I agree hold a big jump is coming the next 3 months to 57.3k,/r/Bitcoin/comments/117sh93/hodl/
29,Hodl 👏,428,117sh93,Bitcoin,/r/Bitcoin/comments/117sh93/hodl/,40,,1676948008.0,"What comes after HODL? I mean how do you prove you're wealthy with BTC? All the people that have made their fortunes with BTC only got rich by selling for fiat.

 How do we make BTC do what fiat and credit cards do? Until it's as easy to use as money I just don't understand how it's anything but a hypothetical store of value. 

That being said I also know that USD and other fiat currencies that are based on debt will be going away eventually and replaced with BRICS CBDCs and other future monies. 

I feel like we're all just screwed in the end and this is just a way to hold on a little longer.",/r/Bitcoin/comments/117sh93/hodl/
30,Hodl 👏,428,117sh93,Bitcoin,/r/Bitcoin/comments/117sh93/hodl/,40,,1676948008.0,Holder always win!,/r/Bitcoin/comments/117sh93/hodl/
31,Hodl 👏,428,117sh93,Bitcoin,/r/Bitcoin/comments/117sh93/hodl/,40,,1676948008.0,Crypto is like poker. You really need a straight face and balls of steel!,/r/Bitcoin/comments/117sh93/hodl/
32,Hodl 👏,428,117sh93,Bitcoin,/r/Bitcoin/comments/117sh93/hodl/,40,,1676948008.0,"""You never count you're Bitcoin, when they're sitting on the exchange. There'll be time enough for countin', when the keys are yours""",/r/Bitcoin/comments/117sh93/hodl/
33,Hodl 👏,428,117sh93,Bitcoin,/r/Bitcoin/comments/117sh93/hodl/,40,,1676948008.0,New poker game. Texas hodlem!,/r/Bitcoin/comments/117sh93/hodl/
34,Hodl 👏,428,117sh93,Bitcoin,/r/Bitcoin/comments/117sh93/hodl/,40,,1676948008.0,Hello and good luck.,/r/Bitcoin/comments/117sh93/hodl/
35,Hodl 👏,428,117sh93,Bitcoin,/r/Bitcoin/comments/117sh93/hodl/,40,,1676948008.0,Thanks for the good luck. Have a nice day to go.,/r/Bitcoin/comments/117sh93/hodl/
36,Hodl 👏,428,117sh93,Bitcoin,/r/Bitcoin/comments/117sh93/hodl/,40,,1676948008.0,"Hi u/JJasonnpan, thanks for tipping u/MoonXBTGlobal **⚡︎500** (satoshis)!
***
*[^(More info)](https://xnf5cwpq73.execute-api.us-west-2.amazonaws.com/prod/info) ^| [^(Balance)](https://www.reddit.com/message/compose/?to=lntipbot&subject=balance&message=!balance) ^| [^(Deposit)](https://www.reddit.com/message/compose/?to=lntipbot&subject=deposit&message=!deposit 10000) ^| [^(Withdraw)](https://www.reddit.com/message/compose/?to=lntipbot&subject=withdraw&message=!withdraw put_invoice_here) ^| ^(Something wrong?  Have a question?) [^(Send me a message)](https://www.reddit.com/message/compose/?to=drmoore718)*",/r/Bitcoin/comments/117sh93/hodl/
37,Hodl 👏,428,117sh93,Bitcoin,/r/Bitcoin/comments/117sh93/hodl/,40,,1676948008.0,You need diamond balls,/r/Bitcoin/comments/117sh93/hodl/
38,Hodl 👏,428,117sh93,Bitcoin,/r/Bitcoin/comments/117sh93/hodl/,40,,1676948008.0,Glad I wasn't the only one with Kenny Rogers vibes on this post.,/r/Bitcoin/comments/117sh93/hodl/
39,Microsoft and Ankr partnered to offer blockchain node infrastructure. Imagine what happens when people realize that Ankr uses Pocket Network as its decentralized blockchain node infrastructure provider.,55,118airx,CryptoMarkets,/r/CryptoMarkets/comments/118airx/microsoft_and_ankr_partnered_to_offer_blockchain/,2,,1676999776.0,"Ankr Pumped 70% after this announcement, I made some good profit on it",/r/CryptoMarkets/comments/118airx/microsoft_and_ankr_partnered_to_offer_blockchain/
40,Microsoft and Ankr partnered to offer blockchain node infrastructure. Imagine what happens when people realize that Ankr uses Pocket Network as its decentralized blockchain node infrastructure provider.,55,118airx,CryptoMarkets,/r/CryptoMarkets/comments/118airx/microsoft_and_ankr_partnered_to_offer_blockchain/,2,,1676999776.0,"Niceeee, I think people sold too soon tbh, especially as this is one of the only $LINK competitors",/r/CryptoMarkets/comments/118airx/microsoft_and_ankr_partnered_to_offer_blockchain/
41,‘Please Do Your Job!!!’: Private Citizens Urge Judge To Jail Bankman-Fried Before Fraud Trial,1746,118fikm,CryptoCurrency,/r/CryptoCurrency/comments/118fikm/please_do_your_job_private_citizens_urge_judge_to/,271,,1677014710.0,"Be advised. This submission either linked to an article written by the Forbes editorial staff or a contributor. Contributor articles are essentially op-ed or non-fact-checked pieces written by people recruited by Forbes and do not necessarily reflect the views of the actual Forbes editorial staff.

---


*I am a bot, and this action was performed automatically. Please [contact the moderators of this subreddit](/message/compose/?to=/r/CryptoCurrency) if you have any questions or concerns.*",/r/CryptoCurrency/comments/118fikm/please_do_your_job_private_citizens_urge_judge_to/
42,‘Please Do Your Job!!!’: Private Citizens Urge Judge To Jail Bankman-Fried Before Fraud Trial,1746,118fikm,CryptoCurrency,/r/CryptoCurrency/comments/118fikm/please_do_your_job_private_citizens_urge_judge_to/,271,,1677014710.0,It really would be better for the whole crypto community for this guy to be sitting in jail,/r/CryptoCurrency/comments/118fikm/please_do_your_job_private_citizens_urge_judge_to/
43,‘Please Do Your Job!!!’: Private Citizens Urge Judge To Jail Bankman-Fried Before Fraud Trial,1746,118fikm,CryptoCurrency,/r/CryptoCurrency/comments/118fikm/please_do_your_job_private_citizens_urge_judge_to/,271,,1677014710.0,"While the tornado cash guy is rotting in jail while his trial is going on, SBF is using VPN to do who knows what. C'mon...",/r/CryptoCurrency/comments/118fikm/please_do_your_job_private_citizens_urge_judge_to/
44,‘Please Do Your Job!!!’: Private Citizens Urge Judge To Jail Bankman-Fried Before Fraud Trial,1746,118fikm,CryptoCurrency,/r/CryptoCurrency/comments/118fikm/please_do_your_job_private_citizens_urge_judge_to/,271,,1677014710.0,"'Please Do Your Job!!!'

What do you mean? He is exactly doing his job. Turning a blind eye for rich and powerful criminals who bribe everyone so in the end they won't face the same repercussions as the average citizen.",/r/CryptoCurrency/comments/118fikm/please_do_your_job_private_citizens_urge_judge_to/
45,‘Please Do Your Job!!!’: Private Citizens Urge Judge To Jail Bankman-Fried Before Fraud Trial,1746,118fikm,CryptoCurrency,/r/CryptoCurrency/comments/118fikm/please_do_your_job_private_citizens_urge_judge_to/,271,,1677014710.0,"Could you imagine if one of us stole billions of dollars. Pretty sure we would disappear off the face of the earth never to be found again. 

This man had some serious political connections. 

The justice system is fucked.",/r/CryptoCurrency/comments/118fikm/please_do_your_job_private_citizens_urge_judge_to/
46,‘Please Do Your Job!!!’: Private Citizens Urge Judge To Jail Bankman-Fried Before Fraud Trial,1746,118fikm,CryptoCurrency,/r/CryptoCurrency/comments/118fikm/please_do_your_job_private_citizens_urge_judge_to/,271,,1677014710.0,Imagine being a victim of the whole FTX disaster and watching all of this unfold. A kick in the nuts,/r/CryptoCurrency/comments/118fikm/please_do_your_job_private_citizens_urge_judge_to/
47,‘Please Do Your Job!!!’: Private Citizens Urge Judge To Jail Bankman-Fried Before Fraud Trial,1746,118fikm,CryptoCurrency,/r/CryptoCurrency/comments/118fikm/please_do_your_job_private_citizens_urge_judge_to/,271,,1677014710.0,"If they dont wanna do it, we will happily do it for them",/r/CryptoCurrency/comments/118fikm/please_do_your_job_private_citizens_urge_judge_to/
48,‘Please Do Your Job!!!’: Private Citizens Urge Judge To Jail Bankman-Fried Before Fraud Trial,1746,118fikm,CryptoCurrency,/r/CryptoCurrency/comments/118fikm/please_do_your_job_private_citizens_urge_judge_to/,271,,1677014710.0,"> ""He continues to mock you and the system of justice,” Morrissey wrote in the newly disclosed note to Kaplan, referring to Bankman-Fried, the former head of cryptocurrency exchange FTX who will stand trial in October for eight criminal counts for fraudulent activities in his one-time multibillion-dollar empire.

That pretty much sums it up. Donate millions, defraud billions, and you just get to continue to mock the justice system.",/r/CryptoCurrency/comments/118fikm/please_do_your_job_private_citizens_urge_judge_to/
49,‘Please Do Your Job!!!’: Private Citizens Urge Judge To Jail Bankman-Fried Before Fraud Trial,1746,118fikm,CryptoCurrency,/r/CryptoCurrency/comments/118fikm/please_do_your_job_private_citizens_urge_judge_to/,271,,1677014710.0,"Yes, please put the fucker in the gulag asap so we can stop hearing about him.",/r/CryptoCurrency/comments/118fikm/please_do_your_job_private_citizens_urge_judge_to/
50,‘Please Do Your Job!!!’: Private Citizens Urge Judge To Jail Bankman-Fried Before Fraud Trial,1746,118fikm,CryptoCurrency,/r/CryptoCurrency/comments/118fikm/please_do_your_job_private_citizens_urge_judge_to/,271,,1677014710.0,Can’t wait for this fucker to be in jail,/r/CryptoCurrency/comments/118fikm/please_do_your_job_private_citizens_urge_judge_to/
51,‘Please Do Your Job!!!’: Private Citizens Urge Judge To Jail Bankman-Fried Before Fraud Trial,1746,118fikm,CryptoCurrency,/r/CryptoCurrency/comments/118fikm/please_do_your_job_private_citizens_urge_judge_to/,271,,1677014710.0,"Even the judge should understand easy instructions like those
1) Find him
2) Put him into jail
3) let him stay there for several years",/r/CryptoCurrency/comments/118fikm/please_do_your_job_private_citizens_urge_judge_to/
52,‘Please Do Your Job!!!’: Private Citizens Urge Judge To Jail Bankman-Fried Before Fraud Trial,1746,118fikm,CryptoCurrency,/r/CryptoCurrency/comments/118fikm/please_do_your_job_private_citizens_urge_judge_to/,271,,1677014710.0,I am with him. If it was a poor guy it would be on jail already.,/r/CryptoCurrency/comments/118fikm/please_do_your_job_private_citizens_urge_judge_to/
53,‘Please Do Your Job!!!’: Private Citizens Urge Judge To Jail Bankman-Fried Before Fraud Trial,1746,118fikm,CryptoCurrency,/r/CryptoCurrency/comments/118fikm/please_do_your_job_private_citizens_urge_judge_to/,271,,1677014710.0,Does anyone else ever wonder if he ever looks up these little articles of himself and scrolls through the comments laughing hysterically to himself?,/r/CryptoCurrency/comments/118fikm/please_do_your_job_private_citizens_urge_judge_to/
54,‘Please Do Your Job!!!’: Private Citizens Urge Judge To Jail Bankman-Fried Before Fraud Trial,1746,118fikm,CryptoCurrency,/r/CryptoCurrency/comments/118fikm/please_do_your_job_private_citizens_urge_judge_to/,271,,1677014710.0,Corruption at its finest. It's not about the crimes you commit but rather how much money you have,/r/CryptoCurrency/comments/118fikm/please_do_your_job_private_citizens_urge_judge_to/
55,‘Please Do Your Job!!!’: Private Citizens Urge Judge To Jail Bankman-Fried Before Fraud Trial,1746,118fikm,CryptoCurrency,/r/CryptoCurrency/comments/118fikm/please_do_your_job_private_citizens_urge_judge_to/,271,,1677014710.0,Tough jail sentence should be given so it becomes deterrent for other wanna be scammers in the future.,/r/CryptoCurrency/comments/118fikm/please_do_your_job_private_citizens_urge_judge_to/
56,‘Please Do Your Job!!!’: Private Citizens Urge Judge To Jail Bankman-Fried Before Fraud Trial,1746,118fikm,CryptoCurrency,/r/CryptoCurrency/comments/118fikm/please_do_your_job_private_citizens_urge_judge_to/,271,,1677014710.0,I won't be shocked if he gets the Cosby treatment. He'll go to jail and then conveniently be let out on a minor technicality that was just oddly missed or some loophole they create themselves.,/r/CryptoCurrency/comments/118fikm/please_do_your_job_private_citizens_urge_judge_to/
57,‘Please Do Your Job!!!’: Private Citizens Urge Judge To Jail Bankman-Fried Before Fraud Trial,1746,118fikm,CryptoCurrency,/r/CryptoCurrency/comments/118fikm/please_do_your_job_private_citizens_urge_judge_to/,271,,1677014710.0,He’s gonna get a slap on the wrist. They always do..,/r/CryptoCurrency/comments/118fikm/please_do_your_job_private_citizens_urge_judge_to/
58,‘Please Do Your Job!!!’: Private Citizens Urge Judge To Jail Bankman-Fried Before Fraud Trial,1746,118fikm,CryptoCurrency,/r/CryptoCurrency/comments/118fikm/please_do_your_job_private_citizens_urge_judge_to/,271,,1677014710.0,Make an example outta this Clown!,/r/CryptoCurrency/comments/118fikm/please_do_your_job_private_citizens_urge_judge_to/
59,‘Please Do Your Job!!!’: Private Citizens Urge Judge To Jail Bankman-Fried Before Fraud Trial,1746,118fikm,CryptoCurrency,/r/CryptoCurrency/comments/118fikm/please_do_your_job_private_citizens_urge_judge_to/,271,,1677014710.0,"What about the heads of the Mormon church, they should be in jail to.",/r/CryptoCurrency/comments/118fikm/please_do_your_job_private_citizens_urge_judge_to/
60,‘Please Do Your Job!!!’: Private Citizens Urge Judge To Jail Bankman-Fried Before Fraud Trial,1746,118fikm,CryptoCurrency,/r/CryptoCurrency/comments/118fikm/please_do_your_job_private_citizens_urge_judge_to/,271,,1677014710.0,"The whole bail system is fucked, but we really don't want a system in which whether or not someone is detained pre-trial is up to public pressure.

What you're seeing is not anything unusual about our system. Rich white guys always get treated gently. If you want to fix that, the answer is not to try and get this one person thrown in jail pre-trial, it's to fix the system that disproportionally hurts poor and minority folks accused of crimes and treats everyone else like a human being.

The answer is fewer people held in jail before trial. Not more.",/r/CryptoCurrency/comments/118fikm/please_do_your_job_private_citizens_urge_judge_to/
61,‘Please Do Your Job!!!’: Private Citizens Urge Judge To Jail Bankman-Fried Before Fraud Trial,1746,118fikm,CryptoCurrency,/r/CryptoCurrency/comments/118fikm/please_do_your_job_private_citizens_urge_judge_to/,271,,1677014710.0,The best perk of SBF being in jail would be not having headlines about him for a while,/r/CryptoCurrency/comments/118fikm/please_do_your_job_private_citizens_urge_judge_to/
62,‘Please Do Your Job!!!’: Private Citizens Urge Judge To Jail Bankman-Fried Before Fraud Trial,1746,118fikm,CryptoCurrency,/r/CryptoCurrency/comments/118fikm/please_do_your_job_private_citizens_urge_judge_to/,271,,1677014710.0,Put his ass in jail already,/r/CryptoCurrency/comments/118fikm/please_do_your_job_private_citizens_urge_judge_to/
63,‘Please Do Your Job!!!’: Private Citizens Urge Judge To Jail Bankman-Fried Before Fraud Trial,1746,118fikm,CryptoCurrency,/r/CryptoCurrency/comments/118fikm/please_do_your_job_private_citizens_urge_judge_to/,271,,1677014710.0,"His friends in high places are protecting him from jail probably. If you have so much donations to these people, it’s very logical 😅",/r/CryptoCurrency/comments/118fikm/please_do_your_job_private_citizens_urge_judge_to/
64,‘Please Do Your Job!!!’: Private Citizens Urge Judge To Jail Bankman-Fried Before Fraud Trial,1746,118fikm,CryptoCurrency,/r/CryptoCurrency/comments/118fikm/please_do_your_job_private_citizens_urge_judge_to/,271,,1677014710.0,">""He continues to mock you and the system of justice,” Morrissey wrote in the newly disclosed note to Kaplan, referring to Bankman-Fried

Well he's not wrong, and he will keep doing it as long as he gets away with it as well. Time to throw the book at him and take away all of this ridiculous privilege he has",/r/CryptoCurrency/comments/118fikm/please_do_your_job_private_citizens_urge_judge_to/
65,‘Please Do Your Job!!!’: Private Citizens Urge Judge To Jail Bankman-Fried Before Fraud Trial,1746,118fikm,CryptoCurrency,/r/CryptoCurrency/comments/118fikm/please_do_your_job_private_citizens_urge_judge_to/,271,,1677014710.0,"tldr; A retired Connecticut police officer has written a handwritten note to the judge overseeing criminal proceedings against Sam Bankman-Fried for allowing him to await trial from his parents' home. ""Why am I being asked to turn him loose in this garden of electronic devices?"" the retired police officer asked the judge. The judge hasn't drastically changed the terms of Bankman

*This summary is auto generated by a bot and not meant to replace reading the original article. As always, DYOR. Get more of today's trending news [here](https://coinfeeds.substack.com).*",/r/CryptoCurrency/comments/118fikm/please_do_your_job_private_citizens_urge_judge_to/
66,‘Please Do Your Job!!!’: Private Citizens Urge Judge To Jail Bankman-Fried Before Fraud Trial,1746,118fikm,CryptoCurrency,/r/CryptoCurrency/comments/118fikm/please_do_your_job_private_citizens_urge_judge_to/,271,,1677014710.0,"If he was jailed for a drug charge or a violent crime they would have him shackled up like hannibal but nope, just stealing billions",/r/CryptoCurrency/comments/118fikm/please_do_your_job_private_citizens_urge_judge_to/
67,‘Please Do Your Job!!!’: Private Citizens Urge Judge To Jail Bankman-Fried Before Fraud Trial,1746,118fikm,CryptoCurrency,/r/CryptoCurrency/comments/118fikm/please_do_your_job_private_citizens_urge_judge_to/,271,,1677014710.0,"They will do their job, for the right price.

Depending where’s more honey, in jailing him because of powerful people pushing it, or going easy on him if other powerful people push that.

What a world we live in, right?",/r/CryptoCurrency/comments/118fikm/please_do_your_job_private_citizens_urge_judge_to/
68,‘Please Do Your Job!!!’: Private Citizens Urge Judge To Jail Bankman-Fried Before Fraud Trial,1746,118fikm,CryptoCurrency,/r/CryptoCurrency/comments/118fikm/please_do_your_job_private_citizens_urge_judge_to/,271,,1677014710.0,"That's where he belongs. Put him in there, I don't trust him at all.",/r/CryptoCurrency/comments/118fikm/please_do_your_job_private_citizens_urge_judge_to/
69,‘Please Do Your Job!!!’: Private Citizens Urge Judge To Jail Bankman-Fried Before Fraud Trial,1746,118fikm,CryptoCurrency,/r/CryptoCurrency/comments/118fikm/please_do_your_job_private_citizens_urge_judge_to/,271,,1677014710.0,He can't just leave his house now either.,/r/CryptoCurrency/comments/118fikm/please_do_your_job_private_citizens_urge_judge_to/
70,‘Please Do Your Job!!!’: Private Citizens Urge Judge To Jail Bankman-Fried Before Fraud Trial,1746,118fikm,CryptoCurrency,/r/CryptoCurrency/comments/118fikm/please_do_your_job_private_citizens_urge_judge_to/,271,,1677014710.0,That face,/r/CryptoCurrency/comments/118fikm/please_do_your_job_private_citizens_urge_judge_to/
71,‘Please Do Your Job!!!’: Private Citizens Urge Judge To Jail Bankman-Fried Before Fraud Trial,1746,118fikm,CryptoCurrency,/r/CryptoCurrency/comments/118fikm/please_do_your_job_private_citizens_urge_judge_to/,271,,1677014710.0,How can one person just fuck up so much,/r/CryptoCurrency/comments/118fikm/please_do_your_job_private_citizens_urge_judge_to/
72,‘Please Do Your Job!!!’: Private Citizens Urge Judge To Jail Bankman-Fried Before Fraud Trial,1746,118fikm,CryptoCurrency,/r/CryptoCurrency/comments/118fikm/please_do_your_job_private_citizens_urge_judge_to/,271,,1677014710.0,Where’s Caroline and the other clowns too?,/r/CryptoCurrency/comments/118fikm/please_do_your_job_private_citizens_urge_judge_to/
73,‘Please Do Your Job!!!’: Private Citizens Urge Judge To Jail Bankman-Fried Before Fraud Trial,1746,118fikm,CryptoCurrency,/r/CryptoCurrency/comments/118fikm/please_do_your_job_private_citizens_urge_judge_to/,271,,1677014710.0,He should be in jail because he has the money to try to escape the country. That risk is enough to make someone be in jail BUT he has important friends in high places. It looks that political donations work.,/r/CryptoCurrency/comments/118fikm/please_do_your_job_private_citizens_urge_judge_to/
74,‘Please Do Your Job!!!’: Private Citizens Urge Judge To Jail Bankman-Fried Before Fraud Trial,1746,118fikm,CryptoCurrency,/r/CryptoCurrency/comments/118fikm/please_do_your_job_private_citizens_urge_judge_to/,271,,1677014710.0,"He should have been in jail a long time ago. There is no reason he is even free right now. 

Multiple public statements of him basically directly confirm that he comingled funds of customers, which is against the Term of Service of FTX.",/r/CryptoCurrency/comments/118fikm/please_do_your_job_private_citizens_urge_judge_to/
75,‘Please Do Your Job!!!’: Private Citizens Urge Judge To Jail Bankman-Fried Before Fraud Trial,1746,118fikm,CryptoCurrency,/r/CryptoCurrency/comments/118fikm/please_do_your_job_private_citizens_urge_judge_to/,271,,1677014710.0,[removed],/r/CryptoCurrency/comments/118fikm/please_do_your_job_private_citizens_urge_judge_to/
76,‘Please Do Your Job!!!’: Private Citizens Urge Judge To Jail Bankman-Fried Before Fraud Trial,1746,118fikm,CryptoCurrency,/r/CryptoCurrency/comments/118fikm/please_do_your_job_private_citizens_urge_judge_to/,271,,1677014710.0,Send him to a Gulag.,/r/CryptoCurrency/comments/118fikm/please_do_your_job_private_citizens_urge_judge_to/
